DNTTIP1	Q99LB0	reviewed	TDIF1_MOUSE	Deoxynucleotidyltransferase terminal-interacting protein 1 (Terminal deoxynucleotidyltransferase-interacting factor 1) (TdIF1) (TdT-interacting factor 1)	Dnttip1 Tdif1	Mus musculus (Mouse)	328	DNA binding [GO:0003677]; enzyme activator activity [GO:0008047]; nucleosome binding [GO:0031491]; protein homodimerization activity [GO:0042803]
TNPO2	Q99LG2	reviewed	TNPO2_MOUSE	Transportin-2 (Karyopherin beta-2b)	Tnpo2	Mus musculus (Mouse)	887	nuclear import signal receptor activity [GO:0061608]; nuclear localization sequence binding [GO:0008139]; small GTPase binding [GO:0031267]
GNL2	Q99LH1	reviewed	NOG2_MOUSE	Nucleolar GTP-binding protein 2	Gnl2	Mus musculus (Mouse)	728	GTP binding [GO:0005525]
ABTB1	Q99LJ2	reviewed	ABTB1_MOUSE	Ankyrin repeat and BTB/POZ domain-containing protein 1	Abtb1 Bpoz	Mus musculus (Mouse)	478	translation elongation factor activity [GO:0003746]
CDK5RAP3	Q99LM2	reviewed	CK5P3_MOUSE	CDK5 regulatory subunit-associated protein 3	Cdk5rap3	Mus musculus (Mouse)	503	cyclin binding [GO:0030332]; MDM2/MDM4 family protein binding [GO:0097371]; mitogen-activated protein kinase binding [GO:0051019]; NF-kappaB binding [GO:0051059]; protein kinase binding [GO:0019901]; protein-containing complex binding [GO:0044877]; ubiquitin-like protein ligase binding [GO:0044389]
DOHH	Q99LN9	reviewed	DOHH_MOUSE	Deoxyhypusine hydroxylase (DOHH) (EC 1.14.99.29) (Deoxyhypusine dioxygenase) (Deoxyhypusine monooxygenase)	Dohh	Mus musculus (Mouse)	302	deoxyhypusine monooxygenase activity [GO:0019135]; iron ion binding [GO:0005506]
MBIP	Q99LQ1	reviewed	MBIP1_MOUSE	MAP3K12-binding inhibitory protein 1 (MAPK upstream kinase-binding inhibitory protein) (MUK-binding inhibitory protein)	Mbip	Mus musculus (Mouse)	341	identical protein binding [GO:0042802]; protein kinase inhibitor activity [GO:0004860]
GTPBP4	Q99ME9	reviewed	GTPB4_MOUSE	GTP-binding protein 4 (Chronic renal failure gene protein) (GTP-binding protein NGB) (Nucleolar GTP-binding protein 1)	Gtpbp4 Crfg Nog1	Mus musculus (Mouse)	634	GTP binding [GO:0005525]; GTPase activity [GO:0003924]; preribosome binding [GO:1990275]; RNA binding [GO:0003723]
DDX50	Q99MJ9	reviewed	DDX50_MOUSE	ATP-dependent RNA helicase DDX50 (EC 3.6.4.13) (DEAD box protein 50) (Gu-beta) (Nucleolar protein Gu2)	Ddx50	Mus musculus (Mouse)	734	ATP binding [GO:0005524]; ATP hydrolysis activity [GO:0016887]; RNA binding [GO:0003723]; RNA helicase activity [GO:0003724]
ADAR	Q99MU3	reviewed	DSRAD_MOUSE	Double-stranded RNA-specific adenosine deaminase (DRADA) (EC 3.5.4.37) (RNA adenosine deaminase 1)	Adar	Mus musculus (Mouse)	1178	double-stranded RNA adenosine deaminase activity [GO:0003726]; double-stranded RNA binding [GO:0003725]; left-handed Z-DNA binding [GO:0003692]; metal ion binding [GO:0046872]; tRNA-specific adenosine deaminase activity [GO:0008251]
INO80B	Q99PT3	reviewed	IN80B_MOUSE	INO80 complex subunit B (High mobility group AT-hook 1-like 4) (PAP-1-associated protein 1) (PAPA-1) (Zinc finger HIT domain-containing protein 4)	Ino80b Hmga1l4 Papa1 Znhit4	Mus musculus (Mouse)	375	metal ion binding [GO:0046872]
NPM3	Q9CPP0	reviewed	NPM3_MOUSE	Nucleoplasmin-3	Npm3	Mus musculus (Mouse)	175	chromatin binding [GO:0003682]; histone binding [GO:0042393]; RNA binding [GO:0003723]
HINT3	Q9CPS6	reviewed	HINT3_MOUSE	Adenosine 5'-monophosphoramidase HINT3 (EC 3.9.1.-) (HINT-4) (Histidine triad nucleotide-binding protein 3) (HINT-3)	Hint3 Hint4	Mus musculus (Mouse)	165	adenosine 5'-monophosphoramidase activity [GO:0043530]; identical protein binding [GO:0042802]; nucleotide binding [GO:0000166]
PNO1	Q9CPS7	reviewed	PNO1_MOUSE	RNA-binding protein PNO1	Pno1	Mus musculus (Mouse)	248	RNA binding [GO:0003723]
NOP16	Q9CPT5	reviewed	NOP16_MOUSE	Nucleolar protein 16	Nop16 D13Wsu177e	Mus musculus (Mouse)	178	
ANAPC11	Q9CPX9	reviewed	APC11_MOUSE	Anaphase-promoting complex subunit 11 (APC11) (Cyclosome subunit 11)	Anapc11	Mus musculus (Mouse)	84	cullin family protein binding [GO:0097602]; ubiquitin protein ligase activity [GO:0061630]; ubiquitin-ubiquitin ligase activity [GO:0034450]; zinc ion binding [GO:0008270]
FBXO36	Q9CQ24	reviewed	FBX36_MOUSE	F-box only protein 36	Fbxo36	Mus musculus (Mouse)	188	
DPH6	Q9CQ28	reviewed	DPH6_MOUSE	Diphthine--ammonia ligase (EC 6.3.1.14) (ATP-binding domain-containing protein 4) (Diphthamide synthase) (Diphthamide synthetase) (Protein DPH6 homolog)	Dph6 Atpbd4	Mus musculus (Mouse)	267	ATP binding [GO:0005524]; diphthine-ammonia ligase activity [GO:0017178]
UBE2T	Q9CQ37	reviewed	UBE2T_MOUSE	Ubiquitin-conjugating enzyme E2 T (EC 2.3.2.23) (E2 ubiquitin-conjugating enzyme T) (Ubiquitin carrier protein T) (Ubiquitin-protein ligase T)	Ube2t	Mus musculus (Mouse)	204	ATP binding [GO:0005524]; chromatin binding [GO:0003682]; ubiquitin conjugating enzyme activity [GO:0061631]; ubiquitin protein ligase binding [GO:0031625]; ubiquitin-protein transferase activity [GO:0004842]
MED21	Q9CQ39	reviewed	MED21_MOUSE	Mediator of RNA polymerase II transcription subunit 21 (Mediator complex subunit 21) (RNA polymerase II holoenzyme component SRB7) (RNAPII complex component SRB7)	Med21 Srb7 Surb7	Mus musculus (Mouse)	144	transcription coactivator activity [GO:0003713]; transcription coregulator activity [GO:0003712]
PTTG1	Q9CQJ7	reviewed	PTTG1_MOUSE	Securin (Pituitary tumor-transforming gene 1 protein)	Pttg1 Pttg	Mus musculus (Mouse)	199	cysteine-type endopeptidase inhibitor activity [GO:0004869]; heat shock protein binding [GO:0031072]; molecular function activator activity [GO:0140677]; ribosome binding [GO:0043022]; SH3 domain binding [GO:0017124]
RDM1	Q9CQK3	reviewed	RDM1_MOUSE	RAD52 motif-containing protein 1	Rdm1	Mus musculus (Mouse)	281	DNA binding [GO:0003677]; RNA binding [GO:0003723]
GEMIN2	Q9CQQ4	reviewed	GEMI2_MOUSE	Gem-associated protein 2 (Gemin-2) (Component of gems 2) (Survival of motor neuron protein-interacting protein 1) (SMN-interacting protein 1)	Gemin2 Sip1	Mus musculus (Mouse)	269	
CLDND1	Q9CQX5	reviewed	CLDN1_MOUSE	Claudin domain-containing protein 1 (Claudin-25)	Cldnd1 Cldn25 D11Moh34	Mus musculus (Mouse)	253	
HSBP1	Q9CQZ1	reviewed	HSBP1_MOUSE	Heat shock factor-binding protein 1	Hsbp1	Mus musculus (Mouse)	76	identical protein binding [GO:0042802]; transcription corepressor activity [GO:0003714]
TMA16	Q9CR02	reviewed	TMA16_MOUSE	Translation machinery-associated protein 16	Tma16	Mus musculus (Mouse)	221	preribosome binding [GO:1990275]
POP4	Q9CR08	reviewed	RPP29_MOUSE	Ribonuclease P protein subunit p29	Pop4 Rpp29	Mus musculus (Mouse)	221	ribonuclease P activity [GO:0004526]; ribonuclease P RNA binding [GO:0033204]
PPID	Q9CR16	reviewed	PPID_MOUSE	Peptidyl-prolyl cis-trans isomerase D (PPIase D) (EC 5.2.1.8) (40 kDa peptidyl-prolyl cis-trans isomerase) (Cyclophilin-40) (CYP-40) (Rotamase D)	Ppid	Mus musculus (Mouse)	370	cyclosporin A binding [GO:0016018]; enzyme binding [GO:0019899]; FK506 binding [GO:0005528]; heat shock protein binding [GO:0031072]; Hsp70 protein binding [GO:0030544]; Hsp90 protein binding [GO:0051879]; nuclear estrogen receptor binding [GO:0030331]; peptidyl-prolyl cis-trans isomerase activity [GO:0003755]; transcription factor binding [GO:0008134]
NUDT8	Q9CR24	reviewed	NUDT8_MOUSE	Mitochondrial coenzyme A diphosphatase NUDT8 (EC 3.6.1.-) (Nucleoside diphosphate-linked moiety X motif 8) (Nudix motif 8)	Nudt8	Mus musculus (Mouse)	210	coenzyme A diphosphatase activity [GO:0010945]; magnesium ion binding [GO:0000287]; manganese ion binding [GO:0030145]
PPDPF	Q9CR37	reviewed	PPDPF_MOUSE	Pancreatic progenitor cell differentiation and proliferation factor (Exocrine differentiation and proliferation factor)	Ppdpf Exdpf	Mus musculus (Mouse)	115	
NSA2	Q9CR47	reviewed	NSA2_MOUSE	Ribosome biogenesis protein NSA2 homolog (L-name-related protein 42) (LNR42) (TGF-beta-inducible nuclear protein 1)	Nsa2 Tinp1	Mus musculus (Mouse)	260	
ATP6V1G1	Q9CR51	reviewed	VATG1_MOUSE	V-type proton ATPase subunit G 1 (V-ATPase subunit G 1) (V-ATPase 13 kDa subunit 1) (Vacuolar proton pump subunit G 1)	Atp6v1g1 Atp6g1	Mus musculus (Mouse)	118	ATP hydrolysis activity [GO:0016887]; ATPase binding [GO:0051117]; proton-transporting ATPase activity, rotational mechanism [GO:0046961]
NKIRAS2	Q9CR56	reviewed	KBRS2_MOUSE	NF-kappa-B inhibitor-interacting Ras-like protein 2 (I-kappa-B-interacting Ras-like protein 2) (Kappa B-Ras protein 2) (KappaB-Ras2)	Nkiras2	Mus musculus (Mouse)	191	GTP binding [GO:0005525]; GTPase activating protein binding [GO:0032794]; GTPase activity [GO:0003924]
FAM32A	Q9CR80	reviewed	FA32A_MOUSE	Protein FAM32A (Ovarian tumor associated gene 12) (OTAG-12)	Fam32a Otag12 MNCb-3154	Mus musculus (Mouse)	112	
EXOSC5	Q9CRA8	reviewed	EXOS5_MOUSE	Exosome complex component RRP46 (Exosome component 5) (Ribosomal RNA-processing protein 46)	Exosc5 D7Wsu180e Rrp46	Mus musculus (Mouse)	235	DNA binding [GO:0003677]
LRRC40	Q9CRC8	reviewed	LRC40_MOUSE	Leucine-rich repeat-containing protein 40	Lrrc40	Mus musculus (Mouse)	602	
ATXN3	Q9CVD2	reviewed	ATX3_MOUSE	Ataxin-3 (EC 3.4.19.12) (Machado-Joseph disease protein 1 homolog)	Atxn3 Mjd	Mus musculus (Mouse)	355	ATPase binding [GO:0051117]; cysteine-type deubiquitinase activity [GO:0004843]; histone deacetylase binding [GO:0042826]; identical protein binding [GO:0042802]; K48-linked deubiquitinase activity [GO:1990380]; K63-linked deubiquitinase activity [GO:0061578]; RNA polymerase II transcription regulatory region sequence-specific DNA binding [GO:0000977]; transcription corepressor binding [GO:0001222]; ubiquitin protein ligase binding [GO:0031625]
FAM133B	Q9CVI2	reviewed	F133B_MOUSE	Protein FAM133B	Fam133b	Mus musculus (Mouse)	245	
GTSF1L	Q9CWD0	reviewed	GTSFL_MOUSE	Gametocyte-specific factor 1-like (Protein FAM112A)	Gtsf1l Fam112a	Mus musculus (Mouse)	151	metal ion binding [GO:0046872]
PFDN1	Q9CWM4	reviewed	PFD1_MOUSE	Prefoldin subunit 1	Pfdn1	Mus musculus (Mouse)	122	amyloid-beta binding [GO:0001540]; protein folding chaperone [GO:0044183]; unfolded protein binding [GO:0051082]
DPH5	Q9CWQ0	reviewed	DPH5_MOUSE	Diphthine methyl ester synthase (EC 2.1.1.314) (Diphthamide biosynthesis methyltransferase)	Dph5	Mus musculus (Mouse)	281	diphthine synthase activity [GO:0004164]
DDAH1	Q9CWS0	reviewed	DDAH1_MOUSE	N(G),N(G)-dimethylarginine dimethylaminohydrolase 1 (DDAH-1) (Dimethylarginine dimethylaminohydrolase 1) (EC 3.5.3.18) (DDAHI) (Dimethylargininase-1)	Ddah1	Mus musculus (Mouse)	285	amino acid binding [GO:0016597]; dimethylargininase activity [GO:0016403]; zinc ion binding [GO:0008270]
SNX10	Q9CWT3	reviewed	SNX10_MOUSE	Sorting nexin-10	Snx10	Mus musculus (Mouse)	201	1-phosphatidylinositol binding [GO:0005545]; ATPase binding [GO:0051117]; phosphatidylinositol phosphate binding [GO:1901981]
DDX28	Q9CWT6	reviewed	DDX28_MOUSE	Probable ATP-dependent RNA helicase DDX28 (EC 3.6.4.13) (Mitochondrial DEAD box protein 28)	Ddx28	Mus musculus (Mouse)	540	ATP binding [GO:0005524]; ATP hydrolysis activity [GO:0016887]; RNA helicase activity [GO:0003724]; rRNA binding [GO:0019843]
PIN4	Q9CWW6	reviewed	PIN4_MOUSE	Peptidyl-prolyl cis-trans isomerase NIMA-interacting 4 (EC 5.2.1.8) (Parvulin-14) (Par14) (Peptidyl-prolyl cis-trans isomerase Pin4) (PPIase Pin4) (Rotamase Pin4)	Pin4	Mus musculus (Mouse)	131	bent DNA binding [GO:0003681]; double-stranded DNA binding [GO:0003690]; peptidyl-prolyl cis-trans isomerase activity [GO:0003755]
DDX47	Q9CWX9	reviewed	DDX47_MOUSE	Probable ATP-dependent RNA helicase DDX47 (EC 3.6.4.13) (DEAD box protein 47)	Ddx47	Mus musculus (Mouse)	455	ATP binding [GO:0005524]; ATP hydrolysis activity [GO:0016887]; RNA binding [GO:0003723]; RNA helicase activity [GO:0003724]
UTP23	Q9CX11	reviewed	UTP23_MOUSE	rRNA-processing protein UTP23 homolog	Utp23	Mus musculus (Mouse)	249	mRNA 3'-UTR binding [GO:0003730]; mRNA 5'-UTR binding [GO:0048027]; small ribosomal subunit rRNA binding [GO:0070181]
WDR55	Q9CX97	reviewed	WDR55_MOUSE	WD repeat-containing protein 55	Wdr55	Mus musculus (Mouse)	388	
PRDM5	Q9CXE0	reviewed	PRDM5_MOUSE	PR domain zinc finger protein 5 (EC 2.1.1.-) (PR domain-containing protein 5)	Prdm5	Mus musculus (Mouse)	599	DNA-binding transcription factor activity, RNA polymerase II-specific [GO:0000981]; DNA-binding transcription factor binding [GO:0140297]; DNA-binding transcription repressor activity, RNA polymerase II-specific [GO:0001227]; metal ion binding [GO:0046872]; methyltransferase activity [GO:0008168]; RNA polymerase II cis-regulatory region sequence-specific DNA binding [GO:0000978]; sequence-specific DNA binding [GO:0043565]; transcription cis-regulatory region binding [GO:0000976]
COQ5	Q9CXI0	reviewed	COQ5_MOUSE	2-methoxy-6-polyprenyl-1,4-benzoquinol methylase, mitochondrial (EC 2.1.1.201) (Ubiquinone biosynthesis methyltransferase COQ5)	Coq5 D5Ertd33e	Mus musculus (Mouse)	327	2-octaprenyl-6-methoxy-1,4-benzoquinone methylase activity [GO:0043333]; methyltransferase activity [GO:0008168]
NIP7	Q9CXK8	reviewed	NIP7_MOUSE	60S ribosome subunit biogenesis protein NIP7 homolog (Nucleolar pre-rRNA processing protein NIP7) (PEachy) (kDa93)	Nip7	Mus musculus (Mouse)	180	RNA binding [GO:0003723]
SNORC	Q9CXL7	reviewed	SNORC_MOUSE	Protein SNORC (Secondary ossification center-associated regulator of chondrocyte maturation protein)	Snorc	Mus musculus (Mouse)	121	
DCUN1D5	Q9CXV9	reviewed	DCNL5_MOUSE	DCN1-like protein 5 (DCNL5) (DCUN1 domain-containing protein 5) (Defective in cullin neddylation protein 1-like protein 5) (Squamous cell carcinoma-related oncogene 5)	Dcun1d5 SCCRO5	Mus musculus (Mouse)	237	cullin family protein binding [GO:0097602]; ubiquitin conjugating enzyme binding [GO:0031624]; ubiquitin-like protein binding [GO:0032182]
BUD23	Q9CY21	reviewed	BUD23_MOUSE	Probable 18S rRNA (guanine-N(7))-methyltransferase (EC 2.1.1.-) (Bud site selection protein 23 homolog) (Williams-Beuren syndrome chromosomal region 22 protein homolog) (rRNA methyltransferase and ribosome maturation factor)	Bud23 Wbscr22	Mus musculus (Mouse)	281	protein heterodimerization activity [GO:0046982]; rRNA (guanine) methyltransferase activity [GO:0016435]
GAR1	Q9CY66	reviewed	GAR1_MOUSE	H/ACA ribonucleoprotein complex subunit 1 (Nucleolar protein family A member 1) (snoRNP protein GAR1)	Gar1 Nola1	Mus musculus (Mouse)	231	box H/ACA snoRNA binding [GO:0034513]; RNA binding [GO:0003723]; snoRNA binding [GO:0030515]; telomerase RNA binding [GO:0070034]
RRS1	Q9CYH6	reviewed	RRS1_MOUSE	Ribosome biogenesis regulatory protein homolog	Rrs1 Rrr MNCb-2643	Mus musculus (Mouse)	365	5S rRNA binding [GO:0008097]
NARF	Q9CYQ7	reviewed	NARF_MOUSE	Nuclear prelamin A recognition factor (Iron-only hydrogenase-like protein 2) (IOP2)	Narf	Mus musculus (Mouse)	462	lamin binding [GO:0005521]
HDHD3	Q9CYW4	reviewed	HDHD3_MOUSE	Haloacid dehalogenase-like hydrolase domain-containing protein 3	Hdhd3	Mus musculus (Mouse)	251	
CENPP	Q9CZ92	reviewed	CENPP_MOUSE	Centromere protein P (CENP-P)	Cenpp	Mus musculus (Mouse)	286	
AEN	Q9CZI9	reviewed	AEN_MOUSE	Apoptosis-enhancing nuclease (EC 3.1.-.-) (Interferon-stimulated 20 kDa exonuclease-like 1)	Aen Isg20l1	Mus musculus (Mouse)	336	DNA exonuclease activity [GO:0004529]; exonuclease activity [GO:0004527]; nucleic acid binding [GO:0003676]
MPPED2	Q9CZJ0	reviewed	MPPD2_MOUSE	Metallophosphoesterase MPPED2 (EC 3.1.-.-) (Metallophosphoesterase domain-containing protein 2)	Mpped2	Mus musculus (Mouse)	294	AMP binding [GO:0016208]; GMP binding [GO:0019002]; manganese ion binding [GO:0030145]; phosphoric diester hydrolase activity [GO:0008081]
UTP11	Q9CZJ1	reviewed	UTP11_MOUSE	Probable U3 small nucleolar RNA-associated protein 11 (U3 snoRNA-associated protein 11) (UTP11-like protein)	Utp11 Utp11l	Mus musculus (Mouse)	253	
VASN	Q9CZT5	reviewed	VASN_MOUSE	Vasorin (Protein slit-like 2)	Vasn Slitl2	Mus musculus (Mouse)	673	transforming growth factor beta binding [GO:0050431]
CMSS1	Q9CZT6	reviewed	CMS1_MOUSE	Protein CMSS1 (Cms1 ribosomal small subunit homolog)	Cmss1	Mus musculus (Mouse)	276	
SHLD3	Q9CZV2	reviewed	SHLD3_MOUSE	Shieldin complex subunit 3 (REV7-interacting novel NHEJ regulator 1)	Shld3 Rinn1	Mus musculus (Mouse)	255	
ACSL3	Q9CZW4	reviewed	ACSL3_MOUSE	Fatty acid CoA ligase Acsl3 (Arachidonate--CoA ligase) (EC 6.2.1.15) (Long-chain acyl-CoA synthetase 3) (LACS 3) (Long-chain-fatty-acid--CoA ligase 3) (EC 6.2.1.3) (Medium-chain acyl-CoA ligase Acsl3) (EC 6.2.1.2)	Acsl3 Acs3 Facl3	Mus musculus (Mouse)	720	arachidonate-CoA ligase activity [GO:0047676]; ATP binding [GO:0005524]; long-chain fatty acid-CoA ligase activity [GO:0004467]; medium-chain fatty acid-CoA ligase activity [GO:0031956]; protein domain specific binding [GO:0019904]; protein kinase binding [GO:0019901]
PINX1	Q9CZX5	reviewed	PINX1_MOUSE	PIN2/TERF1-interacting telomerase inhibitor 1 (67-11-3 protein) (LPTS1) (Liver-related putative tumor suppressor) (Pin2-interacting protein X1) (TRF1-interacting protein 1)	Pinx1 Lpts	Mus musculus (Mouse)	332	protein-containing complex binding [GO:0044877]; telomerase inhibitor activity [GO:0010521]; telomerase RNA binding [GO:0070034]
TWIST2	Q9D030	reviewed	TWST2_MOUSE	Twist-related protein 2 (Dermis-expressed protein 1) (Dermo-1)	Twist2 Dermo1	Mus musculus (Mouse)	160	chromatin binding [GO:0003682]; DNA-binding transcription factor activity [GO:0003700]; DNA-binding transcription factor activity, RNA polymerase II-specific [GO:0000981]; protein dimerization activity [GO:0046983]; protein domain specific binding [GO:0019904]; RNA polymerase II transcription regulatory region sequence-specific DNA binding [GO:0000977]
ALG14	Q9D081	reviewed	ALG14_MOUSE	UDP-N-acetylglucosamine transferase subunit ALG14 homolog	Alg14	Mus musculus (Mouse)	217	
SPC24	Q9D083	reviewed	SPC24_MOUSE	Kinetochore protein Spc24	Spc24 Spbc24	Mus musculus (Mouse)	201	
SRSF9	Q9D0B0	reviewed	SRSF9_MOUSE	Serine/arginine-rich splicing factor 9 (Splicing factor, arginine/serine-rich 9)	Srsf9 Sfrs9	Mus musculus (Mouse)	222	protein domain specific binding [GO:0019904]; RNA binding [GO:0003723]
PBDC1	Q9D0B6	reviewed	PBDC1_MOUSE	Protein PBDC1 (Polysaccharide biosynthesis domain-containing protein 1)	Pbdc1	Mus musculus (Mouse)	198	
RNF115	Q9D0C1	reviewed	RN115_MOUSE	E3 ubiquitin-protein ligase RNF115 (EC 2.3.2.27) (RING finger protein 115) (RING-type E3 ubiquitin transferase RNF115) (Rab7-interacting RING finger protein) (Rabring 7) (Zinc finger protein 364)	Rnf115 Zfp364 Znf364	Mus musculus (Mouse)	305	metal ion binding [GO:0046872]; ubiquitin protein ligase activity [GO:0061630]; ubiquitin-protein transferase activity [GO:0004842]
TRMT5	Q9D0C4	reviewed	TRM5_MOUSE	tRNA (guanine(37)-N1)-methyltransferase (EC 2.1.1.228) (M1G-methyltransferase) (tRNA [GM37] methyltransferase) (tRNA methyltransferase 5 homolog)	Trmt5 Kiaa1393 Trm5	Mus musculus (Mouse)	501	tRNA (guanine(37)-N1)-methyltransferase activity [GO:0052906]
DIMT1	Q9D0D4	reviewed	DIM1_MOUSE	Probable dimethyladenosine transferase (EC 2.1.1.183) (DIM1 dimethyladenosine transferase 1 homolog) (DIM1 dimethyladenosine transferase 1-like) (Probable 18S rRNA (adenine(1779)-N(6)/adenine(1780)-N(6))-dimethyltransferase) (Probable 18S rRNA dimethylase) (Probable S-adenosylmethionine-6-N',N'-adenosyl(rRNA) dimethyltransferase)	Dimt1 Dimt1l	Mus musculus (Mouse)	313	18S rRNA (adenine(1779)-N(6)/adenine(1780)-N(6))-dimethyltransferase activity [GO:0052909]; RNA binding [GO:0003723]; rRNA (adenine-N6,N6-)-dimethyltransferase activity [GO:0000179]
STX17	Q9D0I4	reviewed	STX17_MOUSE	Syntaxin-17	Stx17	Mus musculus (Mouse)	301	protein kinase binding [GO:0019901]; protein phosphatase binding [GO:0019903]; SNAP receptor activity [GO:0005484]; SNARE binding [GO:0000149]
WDSUB1	Q9D0I6	reviewed	WSDU1_MOUSE	WD repeat, SAM and U-box domain-containing protein 1	Wdsub1	Mus musculus (Mouse)	474	ubiquitin-protein transferase activity [GO:0004842]
MRTO4	Q9D0I8	reviewed	MRT4_MOUSE	mRNA turnover protein 4 homolog (Ribosome assembly factor Mrto4)	Mrto4 Mrt4	Mus musculus (Mouse)	239	
RARS1	Q9D0I9	reviewed	SYRC_MOUSE	Arginine--tRNA ligase, cytoplasmic (EC 6.1.1.19) (Arginyl-tRNA synthetase) (ArgRS)	Rars1 Rars	Mus musculus (Mouse)	660	arginine binding [GO:0034618]; arginine-tRNA ligase activity [GO:0004814]; ATP binding [GO:0005524]; tRNA binding [GO:0000049]
ARL2	Q9D0J4	reviewed	ARL2_MOUSE	ADP-ribosylation factor-like protein 2	Arl2	Mus musculus (Mouse)	184	GDP binding [GO:0019003]; GTP binding [GO:0005525]; GTPase activity [GO:0003924]
PTMS	Q9D0J8	reviewed	PTMS_MOUSE	Parathymosin	Ptms	Mus musculus (Mouse)	101	histone binding [GO:0042393]; zinc ion binding [GO:0008270]
DDX56	Q9D0R4	reviewed	DDX56_MOUSE	Probable ATP-dependent RNA helicase DDX56 (EC 3.6.4.13) (ATP-dependent 61 kDa nucleolar RNA helicase) (DEAD box protein 56)	Ddx56 D11Ertd619e Noh61	Mus musculus (Mouse)	546	ATP binding [GO:0005524]; ATP hydrolysis activity [GO:0016887]; protein sequestering activity [GO:0140311]; RNA helicase activity [GO:0003724]; RNA stem-loop binding [GO:0035613]
PPIL1	Q9D0W5	reviewed	PPIL1_MOUSE	Peptidyl-prolyl cis-trans isomerase-like 1 (PPIase) (EC 5.2.1.8) (Rotamase PPIL1)	Ppil1	Mus musculus (Mouse)	166	cyclosporin A binding [GO:0016018]; disordered domain specific binding [GO:0097718]; peptidyl-prolyl cis-trans isomerase activity [GO:0003755]
NUDT14	Q9D142	reviewed	NUD14_MOUSE	Uridine diphosphate glucose pyrophosphatase NUDT14 (UDPG pyrophosphatase) (UGPPase) (EC 3.6.1.45) (Nucleoside diphosphate-linked moiety X motif 14) (Nudix motif 14)	Nudt14	Mus musculus (Mouse)	222	ADP-ribose diphosphatase activity [GO:0047631]; identical protein binding [GO:0042802]; metal ion binding [GO:0046872]; UDP-sugar diphosphatase activity [GO:0008768]
SS18L2	Q9D174	reviewed	S18L2_MOUSE	SS18-like protein 2	Ss18l2 Deb1	Mus musculus (Mouse)	77	
RRP7A	Q9D1C9	reviewed	RRP7A_MOUSE	Ribosomal RNA-processing protein 7 homolog A (Gastric cancer antigen Zg14 homolog)	Rrp7a	Mus musculus (Mouse)	280	RNA binding [GO:0003723]
GET4	Q9D1H7	reviewed	GET4_MOUSE	Golgi to ER traffic protein 4 homolog	Get4	Mus musculus (Mouse)	327	protein-folding chaperone binding [GO:0051087]
MCEE	Q9D1I5	reviewed	MCEE_MOUSE	Methylmalonyl-CoA epimerase, mitochondrial (EC 5.1.99.1) (DL-methylmalonyl-CoA racemase)	Mcee	Mus musculus (Mouse)	178	metal ion binding [GO:0046872]; methylmalonyl-CoA epimerase activity [GO:0004493]
MPHOSPH6	Q9D1Q1	reviewed	MPH6_MOUSE	M-phase phosphoprotein 6	Mphosph6	Mus musculus (Mouse)	161	RNA binding [GO:0003723]
RPL34	Q9D1R9	reviewed	RL34_MOUSE	Large ribosomal subunit protein eL34 (60S ribosomal protein L34)	Rpl34	Mus musculus (Mouse)	117	structural constituent of ribosome [GO:0003735]
BATF3	Q9D275	reviewed	BATF3_MOUSE	Basic leucine zipper transcriptional factor ATF-like 3 (B-ATF-3)	Batf3	Mus musculus (Mouse)	118	DNA-binding transcription factor activity, RNA polymerase II-specific [GO:0000981]; DNA-binding transcription repressor activity, RNA polymerase II-specific [GO:0001227]; RNA polymerase II cis-regulatory region sequence-specific DNA binding [GO:0000978]; sequence-specific double-stranded DNA binding [GO:1990837]
SNAPC3	Q9D2C9	reviewed	SNPC3_MOUSE	snRNA-activating protein complex subunit 3 (SNAPc subunit 3) (Small nuclear RNA-activating complex polypeptide 3)	Snapc3	Mus musculus (Mouse)	407	bent DNA binding [GO:0003681]; RNA polymerase III type 3 promoter sequence-specific DNA binding [GO:0001006]
TSSK3	Q9D2E1	reviewed	TSSK3_MOUSE	Testis-specific serine/threonine-protein kinase 3 (TSK-3) (TSSK-3) (Testis-specific kinase 3) (EC 2.7.11.1) (Serine/threonine-protein kinase 22C)	Tssk3 Stk22c Stk22d	Mus musculus (Mouse)	268	ATP binding [GO:0005524]; magnesium ion binding [GO:0000287]; protein serine kinase activity [GO:0106310]; protein serine/threonine kinase activity [GO:0004674]
SNRNP35	Q9D384	reviewed	U1SBP_MOUSE	U11/U12 small nuclear ribonucleoprotein 35 kDa protein (U11/U12 snRNP 35 kDa protein) (U1 snRNP-binding protein homolog)	Snrnp35 U1snrnpbp	Mus musculus (Mouse)	244	mRNA binding [GO:0003729]; snRNA binding [GO:0017069]
TCHHL1	Q9D3P1	reviewed	TCHL1_MOUSE	Trichohyalin-like protein 1	Tchhl1	Mus musculus (Mouse)	638	calcium ion binding [GO:0005509]; transition metal ion binding [GO:0046914]
SNX29	Q9D3S3	reviewed	SNX29_MOUSE	Sorting nexin-29	Snx29	Mus musculus (Mouse)	818	phosphatidylinositol binding [GO:0035091]
RSPH14	Q9D3W1	reviewed	RSP14_MOUSE	Radial spoke head 14 homolog (Rhabdoid tumor deletion region protein 1)	Rsph14 Rtdr1	Mus musculus (Mouse)	341	
PHF6	Q9D4J7	reviewed	PHF6_MOUSE	PHD finger protein 6	Phf6 Kiaa1823	Mus musculus (Mouse)	364	DNA binding [GO:0003677]; enzyme binding [GO:0019899]; histone binding [GO:0042393]; histone deacetylase binding [GO:0042826]; metal ion binding [GO:0046872]; phosphoprotein binding [GO:0051219]; ribonucleoprotein complex binding [GO:0043021]; scaffold protein binding [GO:0097110]; tubulin binding [GO:0015631]
TAF1D	Q9D4V4	reviewed	TAF1D_MOUSE	TATA box-binding protein-associated factor RNA polymerase I subunit D (TATA box-binding protein-associated factor 1D) (TBP-associated factor 1D) (Transcription initiation factor SL1/TIF-IB subunit D)	Taf1d Josd3	Mus musculus (Mouse)	322	DNA binding [GO:0003677]; identical protein binding [GO:0042802]
CCDC7	Q9D541	reviewed	CCDC7_MOUSE	Coiled-coil domain-containing protein 7 (Protein BIOT2)	Ccdc7 Biot2	Mus musculus (Mouse)	371	
SPATA17	Q9D552	reviewed	SPT17_MOUSE	Spermatogenesis-associated protein 17 (Spermatogenesis-related protein 11)	Spata17 Srg11	Mus musculus (Mouse)	379	calmodulin binding [GO:0005516]
UBXN11	Q9D572	reviewed	UBX11_MOUSE	UBX domain-containing protein 11 (Socius) (UBX domain-containing protein 5)	Ubxn11 D4Bwg1540e Soc Ubxd5	Mus musculus (Mouse)	484	ubiquitin binding [GO:0043130]
HORMAD1	Q9D5T7	reviewed	HORM1_MOUSE	HORMA domain-containing protein 1 (Newborn ovary HORMA protein)	Hormad1 Nohma	Mus musculus (Mouse)	392	
RIN2	Q9D684	reviewed	RIN2_MOUSE	Ras and Rab interactor 2 (Ras interaction/interference protein 2)	Rin2	Mus musculus (Mouse)	903	GTPase activator activity [GO:0005096]; guanyl-nucleotide exchange factor activity [GO:0005085]; small GTPase binding [GO:0031267]
