RPL18	P35980	reviewed	RL18_MOUSE	Large ribosomal subunit protein eL18 (60S ribosomal protein L18)	Rpl18	Mus musculus (Mouse)	188	RNA binding [GO:0003723]; structural constituent of ribosome [GO:0003735]
FGF7	P36363	reviewed	FGF7_MOUSE	Fibroblast growth factor 7 (FGF-7) (Heparin-binding growth factor 7) (HBGF-7) (Keratinocyte growth factor) (KGF)	Fgf7 Fgf-7 Kgf	Mus musculus (Mouse)	194	chemoattractant activity [GO:0042056]; growth factor activity [GO:0008083]; heparin binding [GO:0008201]; type 2 fibroblast growth factor receptor binding [GO:0005111]
PPM1B	P36993	reviewed	PPM1B_MOUSE	Protein phosphatase 1B (EC 3.1.3.16) (Protein phosphatase 2C isoform beta) (PP2C-beta)	Ppm1b Pp2c2 Pppm1b	Mus musculus (Mouse)	390	magnesium ion binding [GO:0000287]; manganese ion binding [GO:0030145]; myosin phosphatase activity [GO:0017018]; protein serine/threonine phosphatase activity [GO:0004722]
ACVR1	P37172	reviewed	ACVR1_MOUSE	Activin receptor type-1 (EC 2.7.11.30) (Activin receptor type I) (ACTR-I) (Serine/threonine-protein kinase receptor R1) (SKR1) (TGF-B superfamily receptor type I) (TSR-I) (TSK-7L)	Acvr1 Acvrlk2 Tgfb1	Mus musculus (Mouse)	509	activin binding [GO:0048185]; activin receptor activity, type I [GO:0016361]; ATP binding [GO:0005524]; BMP receptor activity [GO:0098821]; cadherin binding [GO:0045296]; growth factor binding [GO:0019838]; metal ion binding [GO:0046872]; protein homodimerization activity [GO:0042803]; protein kinase activity [GO:0004672]; protein serine/threonine kinase activity [GO:0004674]; protein tyrosine kinase binding [GO:1990782]; SMAD binding [GO:0046332]; transforming growth factor beta binding [GO:0050431]; transforming growth factor beta receptor activity, type I [GO:0005025]; transmembrane receptor protein serine/threonine kinase activity [GO:0004675]
FEN1	P39749	reviewed	FEN1_MOUSE	Flap endonuclease 1 (FEN-1) (EC 3.1.-.-) (Flap structure-specific endonuclease 1)	Fen1 Fen-1	Mus musculus (Mouse)	378	5'-3' exonuclease activity [GO:0008409]; 5'-flap endonuclease activity [GO:0017108]; DNA binding [GO:0003677]; exonuclease activity [GO:0004527]; flap endonuclease activity [GO:0048256]; magnesium ion binding [GO:0000287]; manganese ion binding [GO:0030145]; RNA-DNA hybrid ribonuclease activity [GO:0004523]
SLC11A1	P41251	reviewed	NRAM1_MOUSE	Natural resistance-associated macrophage protein 1 (NRAMP 1) (Solute carrier family 11 member 1)	Slc11a1 Bcg Ity Lsh Nramp1	Mus musculus (Mouse)	548	cadmium ion transmembrane transporter activity [GO:0015086]; iron ion transmembrane transporter activity [GO:0005381]; manganese ion transmembrane transporter activity [GO:0005384]; metal cation:proton antiporter activity [GO:0051139]; protein homodimerization activity [GO:0042803]; transition metal ion transmembrane transporter activity [GO:0046915]
TXK	P42682	reviewed	TXK_MOUSE	Tyrosine-protein kinase TXK (EC 2.7.10.2) (PTK-RL-18) (Resting lymphocyte kinase)	Txk Rlk	Mus musculus (Mouse)	527	ATP binding [GO:0005524]; non-membrane spanning protein tyrosine kinase activity [GO:0004715]
SOX15	P43267	reviewed	SOX15_MOUSE	Protein SOX-15	Sox15 Sox-15	Mus musculus (Mouse)	231	chromatin binding [GO:0003682]; DNA binding [GO:0003677]; DNA-binding transcription factor activity, RNA polymerase II-specific [GO:0000981]; RNA polymerase II cis-regulatory region sequence-specific DNA binding [GO:0000978]
SIPA1	P46062	reviewed	SIPA1_MOUSE	Signal-induced proliferation-associated protein 1 (Sipa-1) (GTPase-activating protein Spa-1)	Sipa1 Spa-1 Spa1	Mus musculus (Mouse)	1037	GTPase activator activity [GO:0005096]
RPF1	P46935	reviewed	NEDD4_MOUSE	E3 ubiquitin-protein ligase NEDD4 (EC 2.3.2.26) (HECT-type E3 ubiquitin transferase NEDD4) (Neural precursor cell expressed developmentally down-regulated protein 4) (NEDD-4)	Nedd4 Kiaa0093 Nedd-4 Nedd4-1 Nedd4a Rpf1	Mus musculus (Mouse)	887	beta-2 adrenergic receptor binding [GO:0031698]; enzyme binding [GO:0019899]; ionotropic glutamate receptor binding [GO:0035255]; phosphoserine residue binding [GO:0050815]; phosphothreonine residue binding [GO:0050816]; proline-rich region binding [GO:0070064]; protein domain specific binding [GO:0019904]; RNA polymerase binding [GO:0070063]; sodium channel inhibitor activity [GO:0019871]; ubiquitin binding [GO:0043130]; ubiquitin protein ligase activity [GO:0061630]; ubiquitin-protein transferase activity [GO:0004842]
YAP1	P46938	reviewed	YAP1_MOUSE	Transcriptional coactivator YAP1 (Yes-associated protein 1) (Protein yorkie homolog) (Yes-associated protein YAP65 homolog)	Yap1 Yap Yap65	Mus musculus (Mouse)	488	chromatin binding [GO:0003682]; DNA-binding transcription factor binding [GO:0140297]; proline-rich region binding [GO:0070064]; RNA polymerase II cis-regulatory region sequence-specific DNA binding [GO:0000978]; transcription cis-regulatory region binding [GO:0000976]; transcription coactivator activity [GO:0003713]; transcription corepressor activity [GO:0003714]
PAX9	P47242	reviewed	PAX9_MOUSE	Paired box protein Pax-9	Pax9 Pax-9	Mus musculus (Mouse)	342	DNA-binding transcription activator activity, RNA polymerase II-specific [GO:0001228]; DNA-binding transcription factor activity [GO:0003700]; DNA-binding transcription factor activity, RNA polymerase II-specific [GO:0000981]; RNA polymerase II cis-regulatory region sequence-specific DNA binding [GO:0000978]; RNA polymerase II transcription regulatory region sequence-specific DNA binding [GO:0000977]; sequence-specific double-stranded DNA binding [GO:1990837]
WEE1	P47810	reviewed	WEE1_MOUSE	Wee1-like protein kinase (EC 2.7.10.2) (Wee1A kinase)	Wee1	Mus musculus (Mouse)	646	ATP binding [GO:0005524]; magnesium ion binding [GO:0000287]; non-membrane spanning protein tyrosine kinase activity [GO:0004715]; protein kinase activity [GO:0004672]; protein tyrosine kinase activity [GO:0004713]
RPL29	P47915	reviewed	RL29_MOUSE	Large ribosomal subunit protein eL29 (60S ribosomal protein L29)	Rpl29 Rpl43	Mus musculus (Mouse)	160	heparin binding [GO:0008201]; structural constituent of ribosome [GO:0003735]
RPL5	P47962	reviewed	RL5_MOUSE	Large ribosomal subunit protein uL18 (60S ribosomal protein L5)	Rpl5	Mus musculus (Mouse)	297	5S rRNA binding [GO:0008097]; mRNA 3'-UTR binding [GO:0003730]; mRNA 5'-UTR binding [GO:0048027]; mRNA binding [GO:0003729]; structural constituent of ribosome [GO:0003735]; ubiquitin ligase inhibitor activity [GO:1990948]; ubiquitin protein ligase binding [GO:0031625]
RPL13	P47963	reviewed	RL13_MOUSE	Large ribosomal subunit protein eL13 (60S ribosomal protein L13) (A52)	Rpl13	Mus musculus (Mouse)	211	RNA binding [GO:0003723]; structural constituent of ribosome [GO:0003735]
TBCA	P48428	reviewed	TBCA_MOUSE	Tubulin-specific chaperone A (TCP1-chaperonin cofactor A) (Tubulin-folding cofactor A) (CFA)	Tbca	Mus musculus (Mouse)	108	beta-tubulin binding [GO:0048487]; tubulin binding [GO:0015631]
NDP	P48744	reviewed	NDP_MOUSE	Norrin (Norrie disease protein homolog)	Ndp Ndph	Mus musculus (Mouse)	131	cytokine activity [GO:0005125]; frizzled binding [GO:0005109]; protein homodimerization activity [GO:0042803]
CAMLG	P49070	reviewed	CAMLG_MOUSE	Guided entry of tail-anchored proteins factor CAMLG (Calcium signal-modulating cyclophilin ligand)	Camlg Caml Get2	Mus musculus (Mouse)	294	cell adhesion molecule binding [GO:0050839]; ubiquitin protein ligase binding [GO:0031625]
MXI1	P50540	reviewed	MXI1_MOUSE	Max-interacting protein 1 (Max interactor 1)	Mxi1	Mus musculus (Mouse)	228	DNA-binding transcription factor activity, RNA polymerase II-specific [GO:0000981]; protein dimerization activity [GO:0046983]; RNA polymerase II cis-regulatory region sequence-specific DNA binding [GO:0000978]
ACADVL	P50544	reviewed	ACADV_MOUSE	Very long-chain specific acyl-CoA dehydrogenase, mitochondrial (EC 1.3.8.9) (MVLCAD) (VLCAD)	Acadvl Vlcad	Mus musculus (Mouse)	656	acyl-CoA dehydrogenase activity [GO:0003995]; fatty-acyl-CoA binding [GO:0000062]; flavin adenine dinucleotide binding [GO:0050660]; identical protein binding [GO:0042802]; long-chain-acyl-CoA dehydrogenase activity [GO:0004466]; very-long-chain-acyl-CoA dehydrogenase activity [GO:0017099]
TUB	P50586	reviewed	TUB_MOUSE	Tubby protein	Tub Rd5	Mus musculus (Mouse)	505	G protein-coupled receptor binding [GO:0001664]; intraciliary transport particle A binding [GO:0120160]; protein-containing complex binding [GO:0044877]
TNNT2	P50752	reviewed	TNNT2_MOUSE	Troponin T, cardiac muscle (TnTc) (Cardiac muscle troponin T) (cTnT)	Tnnt2	Mus musculus (Mouse)	301	actin binding [GO:0003779]; identical protein binding [GO:0042802]; protein-containing complex binding [GO:0044877]; protein-macromolecule adaptor activity [GO:0030674]; structural constituent of cytoskeleton [GO:0005200]; tropomyosin binding [GO:0005523]; troponin C binding [GO:0030172]; troponin I binding [GO:0031013]
RPL9	P51410	reviewed	RL9_MOUSE	Large ribosomal subunit protein uL6 (60S ribosomal protein L9)	Rpl9	Mus musculus (Mouse)	192	rRNA binding [GO:0019843]; structural constituent of ribosome [GO:0003735]
RORA	P51448	reviewed	RORA_MOUSE	Nuclear receptor ROR-alpha (Nuclear receptor RZR-alpha) (Nuclear receptor subfamily 1 group F member 1) (RAR-related orphan receptor A) (Retinoid-related orphan receptor-alpha)	Rora Nr1f1 Rzra	Mus musculus (Mouse)	523	beta-catenin binding [GO:0008013]; DNA binding [GO:0003677]; DNA-binding transcription factor activity [GO:0003700]; DNA-binding transcription factor activity, RNA polymerase II-specific [GO:0000981]; ligand-activated transcription factor activity [GO:0098531]; nuclear receptor activity [GO:0004879]; oxysterol binding [GO:0008142]; RNA polymerase II cis-regulatory region sequence-specific DNA binding [GO:0000978]; RNA polymerase II transcription regulatory region sequence-specific DNA binding [GO:0000977]; sequence-specific DNA binding [GO:0043565]; transcription coactivator binding [GO:0001223]; transcription coregulator binding [GO:0001221]; transcription corepressor binding [GO:0001222]; zinc ion binding [GO:0008270]
UCK1	P52623	reviewed	UCK1_MOUSE	Uridine-cytidine kinase 1 (UCK 1) (EC 2.7.1.48) (Cytidine monophosphokinase 1) (Uridine monophosphokinase 1)	Uck1 Umpk	Mus musculus (Mouse)	277	ATP binding [GO:0005524]; cytidine kinase activity [GO:0043771]; uridine kinase activity [GO:0004849]
CPT2	P52825	reviewed	CPT2_MOUSE	Carnitine O-palmitoyltransferase 2, mitochondrial (EC 2.3.1.21) (Carnitine palmitoyltransferase II) (CPT II)	Cpt2 Cpt-2	Mus musculus (Mouse)	658	acyltransferase activity [GO:0016746]; carnitine O-octanoyltransferase activity [GO:0008458]; carnitine O-palmitoyltransferase activity [GO:0004095]
HMGA2	P52927	reviewed	HMGA2_MOUSE	High mobility group protein HMGI-C (High mobility group AT-hook protein 2)	Hmga2 Hmgic	Mus musculus (Mouse)	108	5'-deoxyribose-5-phosphate lyase activity [GO:0051575]; C2H2 zinc finger domain binding [GO:0070742]; cAMP response element binding [GO:0035497]; DNA binding, bending [GO:0008301]; DNA-(apurinic or apyrimidinic site) endonuclease activity [GO:0003906]; enzyme binding [GO:0019899]; MH1 domain binding [GO:0035501]; MH2 domain binding [GO:0035500]; minor groove of adenine-thymine-rich DNA binding [GO:0003680]; nucleic acid binding [GO:0003676]; nucleosomal DNA binding [GO:0031492]; RNA polymerase II-specific DNA-binding transcription factor binding [GO:0061629]; SMAD binding [GO:0046332]; transcription cis-regulatory region binding [GO:0000976]; transcription coregulator activity [GO:0003712]; transcription corepressor activity [GO:0003714]
LBX1	P52955	reviewed	LBX1_MOUSE	Transcription factor LBX1 (Ladybird homeobox protein homolog 1)	Lbx1 Lbx1h	Mus musculus (Mouse)	282	DNA-binding transcription factor activity [GO:0003700]; DNA-binding transcription factor activity, RNA polymerase II-specific [GO:0000981]; sequence-specific double-stranded DNA binding [GO:1990837]
RPL10A	P53026	reviewed	RL10A_MOUSE	Large ribosomal subunit protein uL1 (60S ribosomal protein L10a) (CSA-19) (Neural precursor cell expressed developmentally down-regulated protein 6) (NEDD-6)	Rpl10a Nedd-6 Nedd6	Mus musculus (Mouse)	217	RNA binding [GO:0003723]; structural constituent of ribosome [GO:0003735]
PCTP	P53808	reviewed	PPCT_MOUSE	Phosphatidylcholine transfer protein (PC-TP) (START domain-containing protein 2) (StARD2) (StAR-related lipid transfer protein 2)	Pctp Stard2	Mus musculus (Mouse)	214	phosphatidylcholine binding [GO:0031210]; phosphatidylcholine transporter activity [GO:0008525]
ATXN1	P54254	reviewed	ATX1_MOUSE	Ataxin-1 (Spinocerebellar ataxia type 1 protein homolog)	Atxn1 Sca1	Mus musculus (Mouse)	791	chromatin binding [GO:0003682]; DNA binding [GO:0003677]; identical protein binding [GO:0042802]; poly(G) binding [GO:0034046]; poly(U) RNA binding [GO:0008266]; POZ domain binding [GO:0031208]; protein self-association [GO:0043621]; RNA binding [GO:0003723]
NUB1	P54729	reviewed	NUB1_MOUSE	NEDD8 ultimate buster 1 (Negative regulator of ubiquitin-like proteins 1) (Protein BS4)	Nub1 Nyren18	Mus musculus (Mouse)	614	
MAFB	P54841	reviewed	MAFB_MOUSE	Transcription factor MafB (Maf-B) (Kreisler) (Segmentation protein Kr) (Transcription factor Maf-1) (V-maf musculoaponeurotic fibrosarcoma oncogene homolog B)	Mafb Krml Maf1	Mus musculus (Mouse)	323	DNA binding [GO:0003677]; DNA-binding transcription activator activity, RNA polymerase II-specific [GO:0001228]; DNA-binding transcription factor activity, RNA polymerase II-specific [GO:0000981]; identical protein binding [GO:0042802]; protein-containing complex binding [GO:0044877]; RNA polymerase II cis-regulatory region sequence-specific DNA binding [GO:0000978]; sequence-specific DNA binding [GO:0043565]; sequence-specific double-stranded DNA binding [GO:1990837]
RRP1	P56183	reviewed	RRP1_MOUSE	Ribosomal RNA processing protein 1 homolog A (Novel nuclear protein 1) (NNP-1) (Nucleolar protein Nop52) (RRP1-like protein)	Rrp1 Nnp1	Mus musculus (Mouse)	494	
SLC1A3	P56564	reviewed	EAA1_MOUSE	Excitatory amino acid transporter 1 (Glial high affinity glutamate transporter) (High-affinity neuronal glutamate transporter) (GluT-1) (Sodium-dependent glutamate/aspartate transporter 1) (GLAST-1) (Solute carrier family 1 member 3)	Slc1a3 Eaat1 Gmt1	Mus musculus (Mouse)	543	acidic amino acid transmembrane transporter activity [GO:0015172]; amino acid binding [GO:0016597]; glutamate binding [GO:0016595]; glutamate:sodium symporter activity [GO:0015501]; high-affinity L-glutamate transmembrane transporter activity [GO:0005314]; L-glutamate transmembrane transporter activity [GO:0005313]; metal ion binding [GO:0046872]; neutral L-amino acid transmembrane transporter activity [GO:0015175]
EXOSC10	P56960	reviewed	EXOSX_MOUSE	Exosome complex component 10 (EC 3.1.13.-) (Autoantigen PM/Scl 2 homolog) (Polymyositis/scleroderma autoantigen 2 homolog)	Exosc10 Pmscl2	Mus musculus (Mouse)	887	3'-5'-RNA exonuclease activity [GO:0000175]; metal ion binding [GO:0046872]; nucleotide binding [GO:0000166]; RNA exonuclease activity [GO:0004532]; single-stranded RNA binding [GO:0003727]
NRG2	P56974	reviewed	NRG2_MOUSE	Pro-neuregulin-2, membrane-bound isoform (Pro-NRG2) [Cleaved into: Neuregulin-2 (NRG-2) (Divergent of neuregulin 1) (DON-1)]	Nrg2	Mus musculus (Mouse)	756	epidermal growth factor receptor activity [GO:0005006]; epidermal growth factor receptor binding [GO:0005154]; ErbB-3 class receptor binding [GO:0043125]; ErbB-4 class receptor binding [GO:1990631]; growth factor activity [GO:0008083]; receptor ligand activity [GO:0048018]; signaling receptor binding [GO:0005102]
SLX9	P58468	reviewed	SLX9_MOUSE	Ribosome biogenesis protein SLX9 homolog	Slx9 Fam207a	Mus musculus (Mouse)	219	
ASXL1	P59598	reviewed	ASXL1_MOUSE	Polycomb group protein ASXL1 (Additional sex combs-like protein 1)	Asxl1 Kiaa0978	Mus musculus (Mouse)	1514	chromatin binding [GO:0003682]; DNA binding [GO:0003677]; metal ion binding [GO:0046872]; nuclear retinoic acid receptor binding [GO:0042974]; peroxisome proliferator activated receptor binding [GO:0042975]; transcription coactivator activity [GO:0003713]
DOCK4	P59764	reviewed	DOCK4_MOUSE	Dedicator of cytokinesis protein 4	Dock4 Kiaa0716	Mus musculus (Mouse)	1978	GTPase activator activity [GO:0005096]; guanyl-nucleotide exchange factor activity [GO:0005085]; PDZ domain binding [GO:0030165]; receptor tyrosine kinase binding [GO:0030971]; SH3 domain binding [GO:0017124]; small GTPase binding [GO:0031267]
ENSA	P60840	reviewed	ENSA_MOUSE	Alpha-endosulfine (ARPP-19e)	Ensa	Mus musculus (Mouse)	121	phosphatase inhibitor activity [GO:0019212]; potassium channel inhibitor activity [GO:0019870]; protein phosphatase 2A binding [GO:0051721]; protein phosphatase inhibitor activity [GO:0004864]; protein phosphatase regulator activity [GO:0019888]; signaling receptor binding [GO:0005102]
LZTS1	P60853	reviewed	LZTS1_MOUSE	Leucine zipper putative tumor suppressor 1 (F37/Esophageal cancer-related gene-coding leucine-zipper motif) (Fez1)	Lzts1 Fez1	Mus musculus (Mouse)	599	
UBE2M	P61082	reviewed	UBC12_MOUSE	NEDD8-conjugating enzyme Ubc12 (EC 2.3.2.34) (NEDD8 carrier protein) (Ubiquitin-conjugating enzyme E2 M)	Ube2m Ubc-rs2 Ubc12	Mus musculus (Mouse)	183	ATP binding [GO:0005524]; NEDD8 conjugating enzyme activity [GO:0061654]; NEDD8 transferase activity [GO:0019788]; ubiquitin-protein transferase activity [GO:0004842]
TAF13	P61216	reviewed	TAF13_MOUSE	Transcription initiation factor TFIID subunit 13 (Transcription initiation factor TFIID 18 kDa subunit) (TAF(II)18) (TAFII-18) (TAFII18)	Taf13 Taf2k	Mus musculus (Mouse)	124	DNA binding [GO:0003677]; protein heterodimerization activity [GO:0046982]; TBP-class protein binding [GO:0017025]
RPL26	P61255	reviewed	RL26_MOUSE	Large ribosomal subunit protein uL24 (60S ribosomal protein L26) (Silica-induced gene 20 protein) (SIG-20)	Rpl26	Mus musculus (Mouse)	145	mRNA 5'-UTR binding [GO:0048027]; RNA binding [GO:0003723]; structural constituent of ribosome [GO:0003735]
RPL27	P61358	reviewed	RL27_MOUSE	Large ribosomal subunit protein eL27 (60S ribosomal protein L27)	Rpl27	Mus musculus (Mouse)	136	structural constituent of ribosome [GO:0003735]
SMG6	P61406	reviewed	EST1A_MOUSE	Telomerase-binding protein EST1A (EC 3.1.-.-) (Ever shorter telomeres 1A) (Nonsense mediated mRNA decay factor SMG6) (Smg-6 homolog)	Smg6 Est1a Kiaa0732	Mus musculus (Mouse)	1418	DNA polymerase binding [GO:0070182]; metal ion binding [GO:0046872]; ribonucleoprotein complex binding [GO:0043021]; RNA binding [GO:0003723]; RNA endonuclease activity [GO:0004521]; telomerase RNA binding [GO:0070034]; telomeric DNA binding [GO:0042162]
LRCH1	P62046	reviewed	LRCH1_MOUSE	Leucine-rich repeat and calponin homology domain-containing protein 1 (Calponin homology domain-containing protein 1)	Lrch1 Chdc1 Kiaa1016	Mus musculus (Mouse)	709	
USP46	P62069	reviewed	UBP46_MOUSE	Ubiquitin carboxyl-terminal hydrolase 46 (EC 3.4.19.12) (Deubiquitinating enzyme 46) (Ubiquitin thioesterase 46) (Ubiquitin-specific-processing protease 46)	Usp46	Mus musculus (Mouse)	366	cysteine-type deubiquitinase activity [GO:0004843]; deubiquitinase activity [GO:0101005]; metal ion binding [GO:0046872]
RPS11	P62281	reviewed	RS11_MOUSE	Small ribosomal subunit protein uS17 (40S ribosomal protein S11)	Rps11	Mus musculus (Mouse)	158	rRNA binding [GO:0019843]; structural constituent of ribosome [GO:0003735]
LSM3	P62311	reviewed	LSM3_MOUSE	U6 snRNA-associated Sm-like protein LSm3	Lsm3	Mus musculus (Mouse)	102	RNA binding [GO:0003723]; U6 snRNA 3'-end binding [GO:0030629]
TBPL1	P62340	reviewed	TBPL1_MOUSE	TATA box-binding protein-like 1 (TBP-like 1) (21 kDa TBP-like protein) (TATA box-binding protein-related factor 2) (TBP-related factor 2) (TBP-like factor) (TBP-related protein)	Tbpl1 Tlf Tlp Tlp21 Trf2 Trp	Mus musculus (Mouse)	186	general transcription initiation factor activity [GO:0140223]; RNA polymerase II core promoter sequence-specific DNA binding [GO:0000979]; RNA polymerase II general transcription initiation factor activity [GO:0016251]
EEF1A2	P62631	reviewed	EF1A2_MOUSE	Elongation factor 1-alpha 2 (EF-1-alpha-2) (Eukaryotic elongation factor 1 A-2) (eEF1A-2) (Statin-S1)	Eef1a2 Eef1al Stn	Mus musculus (Mouse)	463	GTP binding [GO:0005525]; GTPase activity [GO:0003924]; protein kinase binding [GO:0019901]; translation elongation factor activity [GO:0003746]
RPL18A	P62717	reviewed	RL18A_MOUSE	Large ribosomal subunit protein eL20 (60S ribosomal protein L18a)	Rpl18a	Mus musculus (Mouse)	176	structural constituent of ribosome [GO:0003735]
RPS25	P62852	reviewed	RS25_MOUSE	Small ribosomal subunit protein eS25 (40S ribosomal protein S25)	Rps25	Mus musculus (Mouse)	125	structural constituent of ribosome [GO:0003735]
RPS26	P62855	reviewed	RS26_MOUSE	Small ribosomal subunit protein eS26 (40S ribosomal protein S26)	Rps26	Mus musculus (Mouse)	115	mRNA binding [GO:0003729]; structural constituent of ribosome [GO:0003735]
FAU	P62862	reviewed	RS30_MOUSE	Ubiquitin-like FUBI-ribosomal protein eS30 fusion protein (FAU ubiquitin-like and ribosomal protein S30) [Cleaved into: Ubiquitin-like protein FUBI; Small ribosomal subunit protein eS30 (40S ribosomal protein S30)]	Fau	Mus musculus (Mouse)	133	protein tag activity [GO:0031386]; structural constituent of ribosome [GO:0003735]; ubiquitin protein ligase binding [GO:0031625]
RPL8	P62918	reviewed	RL8_MOUSE	Large ribosomal subunit protein uL2 (60S ribosomal protein L8)	Rpl8	Mus musculus (Mouse)	257	5.8S rRNA binding [GO:1990932]; RNA binding [GO:0003723]; structural constituent of ribosome [GO:0003735]
BLCAP	P62951	reviewed	BLCAP_MOUSE	Bladder cancer-associated protein (Bladder cancer 10 kDa protein) (Bc10)	Blcap Bc10	Mus musculus (Mouse)	87	
RPS27A	P62983	reviewed	RS27A_MOUSE	Ubiquitin-ribosomal protein eS31 fusion protein (Ubiquitin carboxyl extension protein 80) [Cleaved into: Ubiquitin; Small ribosomal subunit protein eS31 (40S ribosomal protein S27a)]	Rps27a Uba80 Ubcep1	Mus musculus (Mouse)	156	metal ion binding [GO:0046872]; protein tag activity [GO:0031386]; structural constituent of ribosome [GO:0003735]; ubiquitin protein ligase binding [GO:0031625]
RAC1	P63001	reviewed	RAC1_MOUSE	Ras-related C3 botulinum toxin substrate 1 (EC 3.6.5.2) (p21-Rac1)	Rac1	Mus musculus (Mouse)	192	ATPase binding [GO:0051117]; enzyme binding [GO:0019899]; G protein activity [GO:0003925]; GTP binding [GO:0005525]; GTP-dependent protein binding [GO:0030742]; GTPase activity [GO:0003924]; histone deacetylase binding [GO:0042826]; protein kinase binding [GO:0019901]; protein-containing complex binding [GO:0044877]; Rho GDP-dissociation inhibitor binding [GO:0051022]; small GTPase binding [GO:0031267]; thioesterase binding [GO:0031996]
SUMO1	P63166	reviewed	SUMO1_MOUSE	Small ubiquitin-related modifier 1 (SUMO-1) (SMT3 homolog 3) (Ubiquitin-homology domain protein PIC1) (Ubiquitin-like protein SMT3C) (Smt3C)	Sumo1 Smt3c Smt3h3 Ubl1	Mus musculus (Mouse)	101	enzyme binding [GO:0019899]; potassium channel regulator activity [GO:0015459]; protein tag activity [GO:0031386]; small protein activating enzyme binding [GO:0044388]; transcription factor binding [GO:0008134]; ubiquitin protein ligase binding [GO:0031625]; ubiquitin-like protein ligase binding [GO:0044389]; ubiquitin-specific protease binding [GO:1990381]
RPS17	P63276	reviewed	RS17_MOUSE	Small ribosomal subunit protein eS17 (40S ribosomal protein S17)	Rps17	Mus musculus (Mouse)	135	structural constituent of ribosome [GO:0003735]
UBE2I	P63280	reviewed	UBC9_MOUSE	SUMO-conjugating enzyme UBC9 (EC 2.3.2.-) (RING-type E3 SUMO transferase UBC9) (SUMO-protein ligase) (Ubiquitin carrier protein 9) (mUBC9) (Ubiquitin carrier protein I) (Ubiquitin-conjugating enzyme E2 I) (Ubiquitin-protein ligase I)	Ube2i Ubc9 Ubce2i Ubce9	Mus musculus (Mouse)	158	ATP binding [GO:0005524]; bHLH transcription factor binding [GO:0043425]; enzyme binding [GO:0019899]; HLH domain binding [GO:0043398]; ionotropic glutamate receptor binding [GO:0035255]; RING-like zinc finger domain binding [GO:0071535]; small protein activating enzyme binding [GO:0044388]; SUMO conjugating enzyme activity [GO:0061656]; SUMO transferase activity [GO:0019789]; transcription coregulator binding [GO:0001221]; ubiquitin-protein transferase activity [GO:0004842]
RPL22	P67984	reviewed	RL22_MOUSE	Large ribosomal subunit protein eL22 (60S ribosomal protein L22) (Heparin-binding protein HBp15)	Rpl22	Mus musculus (Mouse)	128	heparin binding [GO:0008201]; identical protein binding [GO:0042802]; RNA binding [GO:0003723]; structural constituent of ribosome [GO:0003735]
SMPDL3A	P70158	reviewed	ASM3A_MOUSE	Cyclic GMP-AMP phosphodiesterase SMPDL3A (2',3'-cGAMP phosphodiesterase SMPDL3A) (EC 3.1.4.-) (Acid sphingomyelinase-like phosphodiesterase 3a) (ASM-like phosphodiesterase 3a) (EC 3.6.1.15)	Smpdl3a Asml3a	Mus musculus (Mouse)	445	phosphoric diester hydrolase activity [GO:0008081]; zinc ion binding [GO:0008270]
DLG3	P70175	reviewed	DLG3_MOUSE	Disks large homolog 3 (Synapse-associated protein 102) (SAP-102) (SAP102)	Dlg3 Dlgh3	Mus musculus (Mouse)	849	ionotropic glutamate receptor binding [GO:0035255]; kinase binding [GO:0019900]; PDZ domain binding [GO:0030165]; phosphatase binding [GO:0019902]; protein domain specific binding [GO:0019904]; protein phosphatase binding [GO:0019903]; structural constituent of postsynaptic density [GO:0098919]; ubiquitin protein ligase binding [GO:0031625]
TRAF6	P70196	reviewed	TRAF6_MOUSE	TNF receptor-associated factor 6 (EC 2.3.2.27) (E3 ubiquitin-protein ligase TRAF6) (RING-type E3 ubiquitin transferase TRAF6)	Traf6	Mus musculus (Mouse)	530	histone deacetylase binding [GO:0042826]; identical protein binding [GO:0042802]; protein kinase B binding [GO:0043422]; tumor necrosis factor receptor binding [GO:0005164]; tumor necrosis factor receptor superfamily binding [GO:0032813]; ubiquitin conjugating enzyme binding [GO:0031624]; ubiquitin protein ligase activity [GO:0061630]; ubiquitin protein ligase binding [GO:0031625]; ubiquitin-protein transferase activity [GO:0004842]; ubiquitin-ubiquitin ligase activity [GO:0034450]; zinc ion binding [GO:0008270]
