DHX57	Q6P5D3	reviewed	DHX57_MOUSE	Putative ATP-dependent RNA helicase DHX57 (EC 3.6.4.13) (DEAH box protein 57)	Dhx57	Mus musculus (Mouse)	1388	ATP binding [GO:0005524]; ATP hydrolysis activity [GO:0016887]; helicase activity [GO:0004386]; metal ion binding [GO:0046872]; RNA binding [GO:0003723]; RNA helicase activity [GO:0003724]
DGKQ	Q6P5E8	reviewed	DGKQ_MOUSE	Diacylglycerol kinase theta (DAG kinase theta) (EC 2.7.1.107) (EC 2.7.1.93) (Diglyceride kinase theta) (DGK-theta)	Dgkq	Mus musculus (Mouse)	934	alkylglycerol kinase activity [GO:0047649]; ATP binding [GO:0005524]; ATP-dependent diacylglycerol kinase activity [GO:0004143]; DNA-binding transcription factor binding [GO:0140297]; kinase binding [GO:0019900]; metal ion binding [GO:0046872]; phospholipase binding [GO:0043274]; transmembrane receptor protein tyrosine kinase activator activity [GO:0030297]
FKBP15	Q6P9Q6	reviewed	FKB15_MOUSE	FK506-binding protein 15 (FKBP-15) (133 kDa FK506-binding protein) (133 kDa FKBP) (FKBP-133) (WASP and FKBP-like) (WAFL)	Fkbp15 Fkbp133 Kiaa0674	Mus musculus (Mouse)	1216	actin binding [GO:0003779]
DDX51	Q6P9R1	reviewed	DDX51_MOUSE	ATP-dependent RNA helicase DDX51 (EC 3.6.4.13) (DEAD box protein 51)	Ddx51	Mus musculus (Mouse)	639	ATP binding [GO:0005524]; ATP hydrolysis activity [GO:0016887]; RNA binding [GO:0003723]; RNA helicase activity [GO:0003724]
DCAF13	Q6PAC3	reviewed	DCA13_MOUSE	DDB1- and CUL4-associated factor 13 (WD repeat and SOF domain-containing protein 1)	Dcaf13 Gm83 Wdsof1	Mus musculus (Mouse)	445	nuclear estrogen receptor binding [GO:0030331]; ubiquitin ligase-substrate adaptor activity [GO:1990756]
REXO4	Q6PAQ4	reviewed	REXO4_MOUSE	RNA exonuclease 4 (EC 3.1.-.-) (Exonuclease XPMC2) (Prevents mitotic catastrophe 2 protein homolog)	Rexo4 Gm111 Pmc2 Xpmc2h	Mus musculus (Mouse)	432	3'-5' exonuclease activity [GO:0008408]; double-stranded DNA binding [GO:0003690]; endonuclease activity [GO:0004519]; exonuclease activity [GO:0004527]; single-stranded DNA binding [GO:0003697]
PDGFRL	Q6PE55	reviewed	PGFRL_MOUSE	Platelet-derived growth factor receptor-like protein (PDGFR-like protein)	Pdgfrl	Mus musculus (Mouse)	375	
TRA2A	Q6PFR5	reviewed	TRA2A_MOUSE	Transformer-2 protein homolog alpha (TRA-2 alpha) (TRA2-alpha) (Transformer-2 protein homolog A)	Tra2a	Mus musculus (Mouse)	281	identical protein binding [GO:0042802]; RNA binding [GO:0003723]
HJURP	Q6PG16	reviewed	HJURP_MOUSE	Holliday junction recognition protein (Fetal liver expressing gene 1 protein homolog) (mFleg1)	Hjurp Fleg1	Mus musculus (Mouse)	667	DNA binding [GO:0003677]; histone binding [GO:0042393]; identical protein binding [GO:0042802]
CRAMP1	Q6PG95	reviewed	CRML_MOUSE	Protein cramped-like (Cramped chromatin regulator homolog 1) (Hematological and neurological expressed 1-like protein)	Cramp1 Cramp1l Hn1l Kiaa1426 Tce4	Mus musculus (Mouse)	1285	chromatin binding [GO:0003682]; DNA binding [GO:0003677]
NAA50	Q6PGB6	reviewed	NAA50_MOUSE	N-alpha-acetyltransferase 50 (EC 2.3.1.258) (N-acetyltransferase NAT13) (N-epsilon-acetyltransferase 50) (EC 2.3.1.-) (NatE catalytic subunit)	Naa50 Mak3 Nat13	Mus musculus (Mouse)	169	histone H4 acetyltransferase activity [GO:0010485]; peptide alpha-N-acetyltransferase activity [GO:0004596]; peptidyl-lysine acetyltransferase activity [GO:0052858]
MED16	Q6PGF3	reviewed	MED16_MOUSE	Mediator of RNA polymerase II transcription subunit 16 (Mediator complex subunit 16) (Thyroid hormone receptor-associated protein 5) (Thyroid hormone receptor-associated protein complex 95 kDa component) (Trap95) (Vitamin D3 receptor-interacting protein complex 92 kDa component) (DRIP92)	Med16 Thrap5	Mus musculus (Mouse)	828	nuclear thyroid hormone receptor binding [GO:0046966]; transcription coactivator activity [GO:0003713]
GNL3L	Q6PGG6	reviewed	GNL3L_MOUSE	Guanine nucleotide-binding protein-like 3-like protein	Gnl3l	Mus musculus (Mouse)	577	GTP binding [GO:0005525]
DNMBP	Q6TXD4	reviewed	DNMBP_MOUSE	Dynamin-binding protein (Scaffold protein Tuba)	Dnmbp Kiaa1010 Tuba	Mus musculus (Mouse)	1580	guanyl-nucleotide exchange factor activity [GO:0005085]
FEZ2	Q6TYB5	reviewed	FEZ2_MOUSE	Fasciculation and elongation protein zeta-2 (Zygin II) (Zygin-2)	Fez2	Mus musculus (Mouse)	348	
WDFY3	Q6VNB8	reviewed	WDFY3_MOUSE	WD repeat and FYVE domain-containing protein 3 (Beach domain, WD repeat and FYVE domain-containing protein 1) (BWF1)	Wdfy3	Mus musculus (Mouse)	3508	1-phosphatidylinositol binding [GO:0005545]; beta-N-acetylglucosaminylglycopeptide beta-1,4-galactosyltransferase activity [GO:0003831]; metal ion binding [GO:0046872]
NTRK3	Q6VNS1	reviewed	NTRK3_MOUSE	NT-3 growth factor receptor (EC 2.7.10.1) (GP145-TrkC) (Trk-C) (Neurotrophic tyrosine kinase receptor type 3) (TrkC tyrosine kinase)	Ntrk3 TrkC	Mus musculus (Mouse)	825	ATP binding [GO:0005524]; GPI-linked ephrin receptor activity [GO:0005004]; neurotrophin binding [GO:0043121]; neurotrophin receptor activity [GO:0005030]; p53 binding [GO:0002039]; transmembrane receptor protein tyrosine kinase activity [GO:0004714]
DDX55	Q6ZPL9	reviewed	DDX55_MOUSE	ATP-dependent RNA helicase DDX55 (EC 3.6.4.13) (DEAD box protein 55)	Ddx55 Kiaa1595	Mus musculus (Mouse)	600	ATP binding [GO:0005524]; ATP hydrolysis activity [GO:0016887]; RNA binding [GO:0003723]; RNA helicase activity [GO:0003724]
ZNF507	Q6ZPY5	reviewed	ZN507_MOUSE	Zinc finger protein 507	Znf507 Kiaa1084 Zfp507	Mus musculus (Mouse)	941	DNA-binding transcription factor activity, RNA polymerase II-specific [GO:0000981]; metal ion binding [GO:0046872]; RNA polymerase II cis-regulatory region sequence-specific DNA binding [GO:0000978]
NUP188	Q6ZQH8	reviewed	NU188_MOUSE	Nucleoporin NUP188	Nup188 Kiaa0169	Mus musculus (Mouse)	1759	structural constituent of nuclear pore [GO:0017056]
RPS27	Q6ZWU9	reviewed	RS27_MOUSE	Small ribosomal subunit protein eS27 (40S ribosomal protein S27)	Rps27	Mus musculus (Mouse)	84	metal ion binding [GO:0046872]; RNA binding [GO:0003723]; structural constituent of ribosome [GO:0003735]
RPS27L	Q6ZWY3	reviewed	RS27L_MOUSE	Small ribosomal subunit protein eS27-like (40S ribosomal protein S27-like)	Rps27l	Mus musculus (Mouse)	84	cysteine-type endopeptidase activator activity involved in apoptotic process [GO:0008656]; metal ion binding [GO:0046872]; RNA binding [GO:0003723]; structural constituent of ribosome [GO:0003735]; translation activator activity [GO:0008494]
UBE2R2	Q6ZWZ2	reviewed	UB2R2_MOUSE	Ubiquitin-conjugating enzyme E2 R2 (EC 2.3.2.23) (E2 ubiquitin-conjugating enzyme R2) (Ubiquitin carrier protein R2) (Ubiquitin-conjugating enzyme E2-CDC34B) (Ubiquitin-protein ligase R2)	Ube2r2 Cdc34b Ubc3b	Mus musculus (Mouse)	238	ATP binding [GO:0005524]; ubiquitin conjugating enzyme activity [GO:0061631]; ubiquitin-protein transferase activity [GO:0004842]
KYAT3	Q71RI9	reviewed	KAT3_MOUSE	Kynurenine--oxoglutarate transaminase 3 (EC 2.6.1.7) (Cysteine-S-conjugate beta-lyase 2) (EC 4.4.1.13) (Kynurenine aminotransferase 3) (Kynurenine aminotransferase III) (KATIII) (Kynurenine--glyoxylate transaminase) (EC 2.6.1.63) (Kynurenine--oxoglutarate transaminase III)	Kyat3 Ccbl2 Kat3	Mus musculus (Mouse)	455	cysteine-S-conjugate beta-lyase activity [GO:0047804]; kynurenine-glyoxylate transaminase activity [GO:0047315]; kynurenine-oxoglutarate transaminase activity [GO:0016212]; protein homodimerization activity [GO:0042803]; pyridoxal phosphate binding [GO:0030170]
UBFD1	Q78JW9	reviewed	UBFD1_MOUSE	Ubiquitin domain-containing protein UBFD1	Ubfd1 D7Wsu128e	Mus musculus (Mouse)	368	
TIFA	Q793I8	reviewed	TIFA_MOUSE	TRAF-interacting protein with FHA domain-containing protein A (TRAF2-binding protein)	Tifa T2bp	Mus musculus (Mouse)	184	
RPF1	Q7TND5	reviewed	RPF1_MOUSE	Ribosome production factor 1 (Brix domain-containing protein 5) (Ribosome biogenesis protein RPF1)	Rpf1 Bxdc5	Mus musculus (Mouse)	349	RNA binding [GO:0003723]; rRNA primary transcript binding [GO:0042134]
FAR2	Q7TNT2	reviewed	FACR2_MOUSE	Fatty acyl-CoA reductase 2 (EC 1.2.1.84)	Far2	Mus musculus (Mouse)	515	alcohol-forming long-chain fatty acyl-CoA reductase activity [GO:0102965]; alcohol-forming very long-chain fatty acyl-CoA reductase activity [GO:0080019]
INTS3	Q7TPD0	reviewed	INT3_MOUSE	Integrator complex subunit 3 (Int3) (SOSS complex subunit A) (Sensor of single-strand DNA complex subunit A) (SOSS-A) (Sensor of ssDNA subunit A)	Ints3	Mus musculus (Mouse)	1041	
FBXO11	Q7TPD1	reviewed	FBX11_MOUSE	F-box only protein 11	Fbxo11	Mus musculus (Mouse)	930	protein-arginine N-methyltransferase activity [GO:0016274]; ubiquitin-protein transferase activity [GO:0004842]; zinc ion binding [GO:0008270]
RPS6KA6	Q7TPS0	reviewed	KS6A6_MOUSE	Ribosomal protein S6 kinase alpha-6 (S6K-alpha-6) (EC 2.7.11.1)	Rps6ka6	Mus musculus (Mouse)	764	ATP binding [GO:0005524]; magnesium ion binding [GO:0000287]; protein serine kinase activity [GO:0106310]; ribosomal protein S6 kinase activity [GO:0004711]
LDOC1	Q7TPY9	reviewed	LDOC1_MOUSE	Protein LDOC1	Ldoc1 Gm366	Mus musculus (Mouse)	151	
APTX	Q7TQC5	reviewed	APTX_MOUSE	Aprataxin (EC 3.6.1.71) (EC 3.6.1.72) (Forkhead-associated domain histidine triad-like protein) (FHA-HIT)	Aptx	Mus musculus (Mouse)	342	chromatin binding [GO:0003682]; damaged DNA binding [GO:0003684]; DNA 5'-adenosine monophosphate hydrolase activity [GO:0033699]; DNA-3'-diphospho-5'-guanosine diphosphatase [GO:0120108]; double-stranded DNA binding [GO:0003690]; double-stranded RNA binding [GO:0003725]; metal ion binding [GO:0046872]; mismatched DNA binding [GO:0030983]; phosphoglycolate phosphatase activity [GO:0008967]; phosphoprotein binding [GO:0051219]; polynucleotide 3'-phosphatase activity [GO:0046403]; single-strand break-containing DNA binding [GO:1990165]; single-stranded DNA binding [GO:0003697]
LRP10	Q7TQH7	reviewed	LRP10_MOUSE	Low-density lipoprotein receptor-related protein 10 (LRP-10)	Lrp10 Lrp9	Mus musculus (Mouse)	713	low-density lipoprotein particle receptor activity [GO:0005041]
LRRC75A	Q7TSF4	reviewed	LR75A_MOUSE	Leucine-rich repeat-containing protein 75A (Leucine-rich repeat-containing protein FAM211A)	Lrrc75a Fam211a	Mus musculus (Mouse)	339	
PLEKHM1	Q7TSI1	reviewed	PKHM1_MOUSE	Pleckstrin homology domain-containing family M member 1 (PH domain-containing family M member 1)	Plekhm1	Mus musculus (Mouse)	1074	metal ion binding [GO:0046872]
GALNT17	Q7TT15	reviewed	GLT17_MOUSE	Polypeptide N-acetylgalactosaminyltransferase 17 (EC 2.4.1.41) (Polypeptide GalNAc transferase-like protein 3) (GalNAc-T-like protein 3) (pp-GaNTase-like protein 3) (Protein-UDP acetylgalactosaminyltransferase-like protein 3) (UDP-GalNAc:polypeptide N-acetylgalactosaminyltransferase-like protein 3) (Williams-Beuren syndrome chromosomal region 17 protein homolog)	Galnt17 Wbscr17	Mus musculus (Mouse)	598	carbohydrate binding [GO:0030246]; metal ion binding [GO:0046872]; polypeptide N-acetylgalactosaminyltransferase activity [GO:0004653]
PPM1E	Q80TL0	reviewed	PPM1E_MOUSE	Protein phosphatase 1E (EC 3.1.3.16) (Ca(2+)/calmodulin-dependent protein kinase phosphatase N) (CaMKP-N) (CaMKP-nucleus) (CaMKN) (Partner of PIX 1) (Partner of PIX-alpha) (Partner of PIXA)	Ppm1e Camkn Kiaa1072	Mus musculus (Mouse)	749	metal ion binding [GO:0046872]; myosin phosphatase activity [GO:0017018]; protein serine/threonine phosphatase activity [GO:0004722]
RIMS3	Q80U57	reviewed	RIMS3_MOUSE	Regulating synaptic membrane exocytosis protein 3 (Nim3) (RIM3 gamma) (Rab-3-interacting molecule 3) (RIM 3)	Rims3 Kiaa0237	Mus musculus (Mouse)	307	small GTPase binding [GO:0031267]; transmembrane transporter binding [GO:0044325]
SUZ12	Q80U70	reviewed	SUZ12_MOUSE	Polycomb protein Suz12 (Suppressor of zeste 12 protein homolog)	Suz12 D11Ertd530e Kiaa0160	Mus musculus (Mouse)	741	chromatin binding [GO:0003682]; chromatin DNA binding [GO:0031490]; enzyme activator activity [GO:0008047]; histone methyltransferase activity [GO:0042054]; lncRNA binding [GO:0106222]; metal ion binding [GO:0046872]; methylated histone binding [GO:0035064]; promoter-specific chromatin binding [GO:1990841]; RNA binding [GO:0003723]; RNA polymerase II cis-regulatory region sequence-specific DNA binding [GO:0000978]; sequence-specific DNA binding [GO:0043565]; transcription corepressor binding [GO:0001222]
TICAM1	Q80UF7	reviewed	TCAM1_MOUSE	TIR domain-containing adapter molecule 1 (TICAM-1) (Toll-interleukin-1 receptor domain-containing adapter protein inducing interferon beta) (TIR domain-containing adapter protein inducing IFN-beta)	Ticam1 Trif	Mus musculus (Mouse)	732	molecular adaptor activity [GO:0060090]; protein kinase binding [GO:0019901]; signaling adaptor activity [GO:0035591]
SETMAR	Q80UJ9	reviewed	SETMR_MOUSE	Histone-lysine N-methyltransferase SETMAR (EC 2.1.1.357) (SET domain without mariner transposase fusion protein)	Setmar	Mus musculus (Mouse)	309	DNA binding [GO:0003677]; DNA topoisomerase binding [GO:0044547]; double-stranded DNA binding [GO:0003690]; endonuclease activity [GO:0004519]; histone H3K36 dimethyltransferase activity [GO:0140954]; histone H3K36 methyltransferase activity [GO:0046975]; histone H3K4 methyltransferase activity [GO:0042800]; histone methyltransferase activity [GO:0042054]; protein homodimerization activity [GO:0042803]; single-stranded DNA binding [GO:0003697]; single-stranded DNA endodeoxyribonuclease activity [GO:0000014]; zinc ion binding [GO:0008270]
MXD3	Q80US8	reviewed	MAD3_MOUSE	Max dimerization protein 3 (Max dimerizer 3) (Max-associated protein 3)	Mxd3 Mad3	Mus musculus (Mouse)	206	DNA-binding transcription factor activity, RNA polymerase II-specific [GO:0000981]; protein dimerization activity [GO:0046983]; RNA polymerase II cis-regulatory region sequence-specific DNA binding [GO:0000978]
RPP38	Q80UU2	reviewed	RPP38_MOUSE	Ribonuclease P protein subunit p38 (RNaseP protein p38)	Rpp38	Mus musculus (Mouse)	280	ribonuclease P activity [GO:0004526]; ribonuclease P RNA binding [GO:0033204]
SDAD1	Q80UZ2	reviewed	SDA1_MOUSE	Protein SDA1 homolog (SDA1 domain-containing protein 1)	Sdad1	Mus musculus (Mouse)	687	
FANCD2	Q80V62	reviewed	FACD2_MOUSE	Fanconi anemia group D2 protein homolog (Protein FACD2)	Fancd2	Mus musculus (Mouse)	1450	DNA polymerase binding [GO:0070182]
DTX3	Q80V91	reviewed	DTX3_MOUSE	Probable E3 ubiquitin-protein ligase DTX3 (EC 2.3.2.27) (Protein deltex-3) (Deltex3) (mDTX3) (RING-type E3 ubiquitin transferase DTX3)	Dtx3	Mus musculus (Mouse)	347	metal ion binding [GO:0046872]; transferase activity [GO:0016740]
ELL3	Q80VR2	reviewed	ELL3_MOUSE	RNA polymerase II elongation factor ELL3	Ell3	Mus musculus (Mouse)	395	cis-regulatory region sequence-specific DNA binding [GO:0000987]
INKA2	Q80VY2	reviewed	INKA2_MOUSE	PAK4-inhibitor INKA2 (Induced in neural crest by AP2-alpha protein-related homolog) (MInca-r)	Inka2 Fam212b	Mus musculus (Mouse)	300	protein kinase binding [GO:0019901]; protein serine/threonine kinase inhibitor activity [GO:0030291]
DHX33	Q80VY9	reviewed	DHX33_MOUSE	ATP-dependent RNA helicase DHX33 (EC 3.6.4.13) (DEAH box protein 33)	Dhx33	Mus musculus (Mouse)	698	ATP binding [GO:0005524]; ATP hydrolysis activity [GO:0016887]; DNA-binding transcription factor binding [GO:0140297]; double-stranded RNA binding [GO:0003725]; helicase activity [GO:0004386]; mRNA binding [GO:0003729]; rDNA binding [GO:0000182]; ribosomal large subunit binding [GO:0043023]; RNA helicase activity [GO:0003724]
NPM2	Q80W85	reviewed	NPM2_MOUSE	Nucleoplasmin-2	Npm2	Mus musculus (Mouse)	207	ATP-dependent protein-DNA complex displacement activity [GO:0061995]; chromatin binding [GO:0003682]; enzyme binding [GO:0019899]; histone binding [GO:0042393]; identical protein binding [GO:0042802]; RNA binding [GO:0003723]
HOMEZ	Q80W88	reviewed	HOMEZ_MOUSE	Homeobox and leucine zipper protein Homez (Homeodomain leucine zipper-containing factor)	Homez Kiaa1443	Mus musculus (Mouse)	542	DNA binding [GO:0003677]; DNA-binding transcription factor activity, RNA polymerase II-specific [GO:0000981]
MIS18BP1	Q80WQ8	reviewed	M18BP_MOUSE	Mis18-binding protein 1 (Kinetochore-associated protein KNL-2 homolog)	Mis18bp1 Kiaa1903 Knl2 M18bp1	Mus musculus (Mouse)	998	DNA binding [GO:0003677]
FBLL1	Q80WS3	reviewed	FBLL1_MOUSE	rRNA/tRNA 2'-O-methyltransferase fibrillarin-like protein 1 (EC 2.1.1.-) (Protein-glutamine methyltransferase)	Fbll1	Mus musculus (Mouse)	314	histone H2AQ104 methyltransferase activity [GO:1990259]; RNA binding [GO:0003723]; rRNA methyltransferase activity [GO:0008649]
DDRGK1	Q80WW9	reviewed	DDRGK_MOUSE	DDRGK domain-containing protein 1 (UFM1-binding and PCI domain-containing protein 1)	Ddrgk1 Ufbp1	Mus musculus (Mouse)	315	RNA polymerase II-specific DNA-binding transcription factor binding [GO:0061629]; ubiquitin-like protein ligase binding [GO:0044389]
NUCKS1	Q80XU3	reviewed	NUCKS_MOUSE	Nuclear ubiquitous casein and cyclin-dependent kinase substrate 1 (JC7)	Nucks1 Nucks	Mus musculus (Mouse)	234	chromatin binding [GO:0003682]; DNA-binding transcription factor binding [GO:0140297]; double-stranded DNA binding [GO:0003690]; single-stranded DNA binding [GO:0003697]; transcription coactivator activity [GO:0003713]
ARHGAP11A	Q80Y19	reviewed	RHGBA_MOUSE	Rho GTPase-activating protein 11A (Rho-type GTPase-activating protein 11A)	Arhgap11a Kiaa0013	Mus musculus (Mouse)	987	GTPase activator activity [GO:0005096]
DDX10	Q80Y44	reviewed	DDX10_MOUSE	Probable ATP-dependent RNA helicase DDX10 (EC 3.6.4.13) (DEAD box protein 10)	Ddx10	Mus musculus (Mouse)	875	ATP binding [GO:0005524]; ATP hydrolysis activity [GO:0016887]; RNA binding [GO:0003723]; RNA helicase activity [GO:0003724]
GPR137	Q80ZU9	reviewed	G137A_MOUSE	Integral membrane protein GPR137 (Transmembrane 7 superfamily member 1-like 1 protein)	Gpr137 Tm7sf1l1	Mus musculus (Mouse)	396	
GRWD1	Q810D6	reviewed	GRWD1_MOUSE	Glutamate-rich WD repeat-containing protein 1 (Protein A301)	Grwd1 A301	Mus musculus (Mouse)	446	chromatin binding [GO:0003682]; DNA replication origin binding [GO:0003688]; histone binding [GO:0042393]
PRIMA1	Q810F0	reviewed	PRIMA_MOUSE	Proline-rich membrane anchor 1 (PRiMA)	Prima1	Mus musculus (Mouse)	153	enzyme binding [GO:0019899]; protein-membrane adaptor activity [GO:0043495]
MPHOSPH10	Q810V0	reviewed	MPP10_MOUSE	U3 small nucleolar ribonucleoprotein protein MPP10 (M phase phosphoprotein 10)	Mphosph10	Mus musculus (Mouse)	681	
ADAMTS12	Q811B3	reviewed	ATS12_MOUSE	A disintegrin and metalloproteinase with thrombospondin motifs 12 (ADAM-TS 12) (ADAM-TS12) (ADAMTS-12) (EC 3.4.24.-)	Adamts12	Mus musculus (Mouse)	1600	metal ion binding [GO:0046872]; metalloendopeptidase activity [GO:0004222]
PCID2	Q8BFV2	reviewed	PCID2_MOUSE	PCI domain-containing protein 2 (CSN12-like protein)	Pcid2	Mus musculus (Mouse)	399	double-stranded DNA binding [GO:0003690]; RNA binding [GO:0003723]
SLC6A15	Q8BG16	reviewed	S6A15_MOUSE	Sodium-dependent neutral amino acid transporter B(0)AT2 (Sodium- and chloride-dependent neurotransmitter transporter NTT73) (Solute carrier family 6 member 15) (Transporter v7-3)	Slc6a15 B0at2 Ntt73	Mus musculus (Mouse)	729	branched-chain amino acid:sodium symporter activity [GO:0015657]; neutral L-amino acid:sodium symporter activity [GO:0005295]; proline:sodium symporter activity [GO:0005298]
NOL12	Q8BG17	reviewed	NOL12_MOUSE	Nucleolar protein 12 (Nucleolar protein of 25 kDa)	Nol12 Nop25	Mus musculus (Mouse)	217	identical protein binding [GO:0042802]; RNA binding [GO:0003723]; rRNA binding [GO:0019843]; single-stranded DNA binding [GO:0003697]
DMRT2	Q8BG36	reviewed	DMRT2_MOUSE	Doublesex- and mab-3-related transcription factor 2 (Doublesex-like 2 protein) (Terra)	Dmrt2	Mus musculus (Mouse)	561	DNA-binding transcription activator activity, RNA polymerase II-specific [GO:0001228]; DNA-binding transcription factor activity, RNA polymerase II-specific [GO:0000981]; identical protein binding [GO:0042802]; metal ion binding [GO:0046872]; RNA polymerase II cis-regulatory region sequence-specific DNA binding [GO:0000978]; RNA polymerase II transcription regulatory region sequence-specific DNA binding [GO:0000977]; sequence-specific DNA binding [GO:0043565]
KRR1	Q8BGA5	reviewed	KRR1_MOUSE	KRR1 small subunit processome component homolog (HIV-1 Rev-binding protein 2 homolog) (KRR-R motif-containing protein 1)	Krr1 Hrb2	Mus musculus (Mouse)	380	RNA binding [GO:0003723]
ENOPH1	Q8BGB7	reviewed	ENOPH_MOUSE	Enolase-phosphatase E1 (EC 3.1.3.77) (2,3-diketo-5-methylthio-1-phosphopentane phosphatase) (MASA homolog)	Enoph1 Masa	Mus musculus (Mouse)	257	2,3-diketo-5-methylthiopentyl-1-phosphate enolase activity [GO:0043715]; 2-hydroxy-3-keto-5-methylthiopentenyl-1-phosphate phosphatase activity [GO:0043716]; acireductone synthase activity [GO:0043874]; magnesium ion binding [GO:0000287]
FAM13A	Q8BGI4	reviewed	FA13A_MOUSE	Protein FAM13A (Precm1 protein)	Fam13a Fam13a1 Precm1	Mus musculus (Mouse)	693	
ADPRHL1	Q8BGK2	reviewed	ARHL1_MOUSE	Inactive ADP-ribosyltransferase ARH2 (ADP-ribosylhydrolase-like protein 1) ([Protein ADP-ribosylarginine] hydrolase-like protein 1)	Adprhl1 Arh2	Mus musculus (Mouse)	353	ADP-ribosylarginine hydrolase activity [GO:0003875]; magnesium ion binding [GO:0000287]
POMT2	Q8BGQ4	reviewed	POMT2_MOUSE	Protein O-mannosyl-transferase 2 (EC 2.4.1.109) (Dolichyl-phosphate-mannose--protein mannosyltransferase 2)	Pomt2	Mus musculus (Mouse)	820	dolichyl-phosphate-mannose-protein mannosyltransferase activity [GO:0004169]; mannosyltransferase activity [GO:0000030]
EFCAB14	Q8BGQ6	reviewed	EFC14_MOUSE	EF-hand calcium-binding domain-containing protein 14	Efcab14 Kiaa0494	Mus musculus (Mouse)	484	metal ion binding [GO:0046872]
GSKIP	Q8BGR8	reviewed	GSKIP_MOUSE	GSK3B-interacting protein (GSKIP)	Gskip	Mus musculus (Mouse)	139	kinase regulator activity [GO:0019207]; protein kinase A binding [GO:0051018]; protein kinase A regulatory subunit binding [GO:0034237]; protein kinase binding [GO:0019901]; protein kinase inhibitor activity [GO:0004860]
UBLCP1	Q8BGR9	reviewed	UBCP1_MOUSE	Ubiquitin-like domain-containing CTD phosphatase 1 (EC 3.1.3.16) (Nuclear proteasome inhibitor UBLCP1)	Ublcp1	Mus musculus (Mouse)	318	metal ion binding [GO:0046872]; myosin phosphatase activity [GO:0017018]; proteasome regulatory particle binding [GO:1904855]; protein serine/threonine phosphatase activity [GO:0004722]
MAK16	Q8BGS0	reviewed	MAK16_MOUSE	Protein MAK16 homolog (Protein RBM13)	Mak16 Rbm13	Mus musculus (Mouse)	296	
CCNY	Q8BGU5	reviewed	CCNY_MOUSE	Cyclin-Y (Cyclin fold protein 1)	Ccny Cfp1	Mus musculus (Mouse)	341	cyclin-dependent protein serine/threonine kinase activator activity [GO:0061575]; cyclin-dependent protein serine/threonine kinase regulator activity [GO:0016538]; protein kinase binding [GO:0019901]
TACSTD2	Q8BGV3	reviewed	TACD2_MOUSE	Tumor-associated calcium signal transducer 2 (Cell surface glycoprotein Trop-2)	Tacstd2 Trop2	Mus musculus (Mouse)	317	
B3GNT5	Q8BGY6	reviewed	B3GN5_MOUSE	Lactosylceramide 1,3-N-acetyl-beta-D-glucosaminyltransferase (EC 2.4.1.206) (Lactotriaosylceramide synthase) (Lc(3)Cer synthase) (Lc3 synthase) (UDP-GlcNAc:beta-Gal beta-1,3-N-acetylglucosaminyltransferase 5) (BGnT-5) (Beta-1,3-Gn-T5) (Beta-1,3-N-acetylglucosaminyltransferase 5) (Beta3Gn-T5)	B3gnt5	Mus musculus (Mouse)	376	beta-galactosyl-N-acetylglucosaminylgalactosylglucosyl-ceramide beta-1,3-acetylglucosaminyltransferase activity [GO:0008457]; lactosylceramide 1,3-N-acetyl-beta-D-glucosaminyltransferase activity [GO:0047256]
FBXL2	Q8BH16	reviewed	FBXL2_MOUSE	F-box/LRR-repeat protein 2 (F-box and leucine-rich repeat protein 2)	Fbxl2	Mus musculus (Mouse)	423	calmodulin binding [GO:0005516]; phosphatidylinositol 3-kinase regulatory subunit binding [GO:0036312]; protein phosphatase binding [GO:0019903]; ubiquitin ligase-substrate adaptor activity [GO:1990756]
WDR3	Q8BHB4	reviewed	WDR3_MOUSE	WD repeat-containing protein 3	Wdr3	Mus musculus (Mouse)	942	snoRNA binding [GO:0030515]
TMEM108	Q8BHE4	reviewed	TM108_MOUSE	Transmembrane protein 108 (Retrolinkin)	Tmem108	Mus musculus (Mouse)	574	
OSCP1	Q8BHW2	reviewed	OSCP1_MOUSE	Protein OSCP1	Oscp1	Mus musculus (Mouse)	379	transmembrane transporter activity [GO:0022857]
CDCA8	Q8BHX3	reviewed	BOREA_MOUSE	Borealin (Cell division cycle-associated protein 8) (MESrg)	Cdca8	Mus musculus (Mouse)	289	
NOC4L	Q8BHY2	reviewed	NOC4L_MOUSE	Nucleolar complex protein 4 homolog (NOC4 protein homolog) (NOC4-like protein) (Nucleolar complex-associated protein 4-like protein)	Noc4l	Mus musculus (Mouse)	516	
SH2D7	Q8BI17	reviewed	SH2D7_MOUSE	SH2 domain-containing protein 7	Sh2d7	Mus musculus (Mouse)	458	
ZNF787	Q8BIF9	reviewed	ZN787_MOUSE	Zinc finger protein 787	Znf787 Zfp787	Mus musculus (Mouse)	381	DNA-binding transcription factor activity, RNA polymerase II-specific [GO:0000981]; metal ion binding [GO:0046872]; sequence-specific DNA binding [GO:0043565]; sequence-specific double-stranded DNA binding [GO:1990837]
ZC3H14	Q8BJ05	reviewed	ZC3HE_MOUSE	Zinc finger CCCH domain-containing protein 14	Zc3h14	Mus musculus (Mouse)	735	metal ion binding [GO:0046872]; poly(A) binding [GO:0008143]
THAP3	Q8BJ25	reviewed	THAP3_MOUSE	THAP domain-containing protein 3	Thap3	Mus musculus (Mouse)	218	DNA binding [GO:0003677]; metal ion binding [GO:0046872]
ZNF771	Q8BJ90	reviewed	ZN771_MOUSE	Zinc finger protein 771	Znf771 Zfp771	Mus musculus (Mouse)	317	DNA-binding transcription activator activity, RNA polymerase II-specific [GO:0001228]; metal ion binding [GO:0046872]; RNA polymerase II cis-regulatory region sequence-specific DNA binding [GO:0000978]; sequence-specific double-stranded DNA binding [GO:1990837]
TYW1	Q8BJM7	reviewed	TYW1_MOUSE	S-adenosyl-L-methionine-dependent tRNA 4-demethylwyosine synthase TYW1 (EC 4.1.3.44) (Radical S-adenosyl methionine and flavodoxin domain-containing protein 1) (tRNA wybutosine-synthesizing protein 1 homolog) (tRNA-yW-synthesizing protein)	Tyw1 Rsafd1	Mus musculus (Mouse)	721	4 iron, 4 sulfur cluster binding [GO:0051539]; FMN binding [GO:0010181]; metal ion binding [GO:0046872]; tRNA-4-demethylwyosine synthase activity [GO:0102521]
NOL11	Q8BJW5	reviewed	NOL11_MOUSE	Nucleolar protein 11	Nol11	Mus musculus (Mouse)	723	
